AuthorID,Author,Date,Content,Attachments,Reactions
"460537401874448385","Dafydd#8863","05-Aug-22 08:33 PM","world is packed = like loading up packages in a virtual world. Not close to max = min, min = Minecraft. The answer could be on a minecraft server 😆","",""
"988688611597766707","jackh1#6251","05-Aug-22 08:33 PM","It references queen victoria","",""
"988688611597766707","jackh1#6251","05-Aug-22 08:33 PM","…","",""
"988688611597766707","jackh1#6251","05-Aug-22 08:33 PM","Also the first sentence is in quotes…","",""
"208078389628764161","c0mplex#7611","05-Aug-22 08:34 PM","Official max fosh minecraft server is coming!!1!1","","😆 (2)"
"318649930371563520","Hyperterdle6#7817","05-Aug-22 08:34 PM","Mine Fosh","",""
"460537401874448385","Dafydd#8863","05-Aug-22 08:35 PM","there are a lot of  kids with squeaky voices on minecraft right","",""
"494294190788837397","relativelypositive#0493","05-Aug-22 08:36 PM","time to build a goldfosh statue in minecraft tonight i guess 😂","","😆 (1)"
"460537401874448385","Dafydd#8863","05-Aug-22 08:37 PM","The title is I've hidden 100k Diamond Treasure 😆","",""
"736619949732397140","Theflyingbirb#1128","05-Aug-22 08:48 PM","OH YOU LITTLE","",""
"736619949732397140","Theflyingbirb#1128","05-Aug-22 08:48 PM","I WANT TO SLAP YOU WITH A FISH","",""
"988688611597766707","jackh1#6251","05-Aug-22 08:49 PM","Ok here’s the clues","",""
"988688611597766707","jackh1#6251","05-Aug-22 08:49 PM","1","",""
"988688611597766707","jackh1#6251","05-Aug-22 08:49 PM","It’s not Jason donavon","",""
"988688611597766707","jackh1#6251","05-Aug-22 08:49 PM","2 it’s the phrase “in the name of max fosh dish out the fish”","",""
"988688611597766707","jackh1#6251","05-Aug-22 08:49 PM","3","",""
"988688611597766707","jackh1#6251","05-Aug-22 08:49 PM","It could be Courtney act","",""
"766410028286083082","JayHawk#4900","05-Aug-22 08:49 PM","Nah bro fr tho we totally didn’t know that","",""
"988688611597766707","jackh1#6251","05-Aug-22 08:49 PM","4","",""
"988688611597766707","jackh1#6251","05-Aug-22 08:49 PM","Idk","",""
"988688611597766707","jackh1#6251","05-Aug-22 08:50 PM","Mabe queen victoria","",""
"988688611597766707","jackh1#6251","05-Aug-22 08:50 PM","Why would Joe Jenkins be there tho","",""
"494294190788837397","relativelypositive#0493","05-Aug-22 08:59 PM","Have we tried reaching out to Courtney Act to ask?","",""
"494294190788837397","relativelypositive#0493","05-Aug-22 08:59 PM","Because out of all the clues I've seen so far, that one is my favorite one","",""
"836939632892706887","LePixel#0242","05-Aug-22 09:01 PM","Is there someone to find on tiktok, i've search for someone with à squeaky voice but i'm not sur to what to do","",""
"127879348463075338","Them#5529","05-Aug-22 09:01 PM","lol good luck","",""
"127879348463075338","Them#5529","05-Aug-22 09:01 PM","TikToker with squeaky voice hmm","",""
"494294190788837397","relativelypositive#0493","05-Aug-22 09:02 PM","I have no idea what the timeline of this video's production was, but they did a book signing in London in mid-July, perhaps an ideal time to pick up the fish?","",""
"761664600571379785","flyingdutchboy1#1415","05-Aug-22 09:02 PM","I still think squeaky voice refers to mouse as you need to use your computer mouse","",""
"494294190788837397","relativelypositive#0493","05-Aug-22 09:02 PM","And then Far from Max, we're talking literally Australia","",""
"836939632892706887","LePixel#0242","05-Aug-22 09:02 PM","A lot of People posted videos after he said it","",""
"811990176528072756","stainingdream#9170","05-Aug-22 09:02 PM","Some one call I have a lot of clued","",""
"811990176528072756","stainingdream#9170","05-Aug-22 09:03 PM","Clues","",""
"494294190788837397","relativelypositive#0493","05-Aug-22 09:03 PM","there's a voice chat going I believe","",""
"127879348463075338","Them#5529","05-Aug-22 09:03 PM","whats the courtney act connection","",""
"417383214295023627","Moonagejames#1476","05-Aug-22 09:03 PM","We know, that this","",""
"836939632892706887","LePixel#0242","05-Aug-22 09:04 PM","Or maybe call somewhere and say the first sentence","",""
"988688611597766707","jackh1#6251","05-Aug-22 09:04 PM","Bro","",""
"494294190788837397","relativelypositive#0493","05-Aug-22 09:04 PM","i'm not adding much new information, i'm only repeating what I saw in this chat already","",""
"988688611597766707","jackh1#6251","05-Aug-22 09:04 PM","Bro","",""
"988688611597766707","jackh1#6251","05-Aug-22 09:04 PM","Bro","",""
"988688611597766707","jackh1#6251","05-Aug-22 09:04 PM","I know","",""
"417383214295023627","Moonagejames#1476","05-Aug-22 09:04 PM","","https://cdn.discordapp.com/attachments/1004807711709470821/1005189610554531891/38C287D0-BEC7-4C82-A7CF-2BD127072670.jpg",""
"988688611597766707","jackh1#6251","05-Aug-22 09:04 PM","On tiktok go to sounds and type max fosh","",""
"417383214295023627","Moonagejames#1476","05-Aug-22 09:04 PM","Was filmed on the 28/07","",""
"988688611597766707","jackh1#6251","05-Aug-22 09:04 PM","There’s an account who has made some sounds","",""
"270833265898815498","Skotte#5170","05-Aug-22 09:05 PM","Has he changed his description?","",""
"988688611597766707","jackh1#6251","05-Aug-22 09:05 PM","The account is called max fish","",""
"270833265898815498","Skotte#5170","05-Aug-22 09:05 PM","On the video","",""
"811990176528072756","stainingdream#9170","05-Aug-22 09:05 PM","He has nothing to do with it I called his number","",""
"988688611597766707","jackh1#6251","05-Aug-22 09:05 PM","","https://cdn.discordapp.com/attachments/1004807711709470821/1005189772261724190/IMG_0384.png",""
"988688611597766707","jackh1#6251","05-Aug-22 09:05 PM","The names sound like something max fosh would put","",""
"811990176528072756","stainingdream#9170","05-Aug-22 09:06 PM","Can some one pick up","",""
"811990176528072756","stainingdream#9170","05-Aug-22 09:06 PM","I have so much to explain","",""
"494294190788837397","relativelypositive#0493","05-Aug-22 09:06 PM","i told you if you wanna  talk, jump in the voice chat channels below, scroll down and click","",""
"494294190788837397","relativelypositive#0493","05-Aug-22 09:06 PM","dont spam call individuals","",""
"811990176528072756","stainingdream#9170","05-Aug-22 09:07 PM","You cannot talk in there littery","",""
"1004912146578145340","Gunther#6943","05-Aug-22 09:07 PM","Might be a red herring but if you search the song through Google it matches with a song called ""Masquerade"" which is the book that Joanna referred to. The matching song is from ""Phantom of the Opera"" which could relate to ""that's beyond a fact""","","upvote (3),foshsalute (1),redherring (2)"
"836939632892706887","LePixel#0242","05-Aug-22 09:07 PM","And what about the bus and thé old Queen ?","",""
"811990176528072756","stainingdream#9170","05-Aug-22 09:07 PM","Tv show very old","",""
"811990176528072756","stainingdream#9170","05-Aug-22 09:08 PM","What is based on a bus in London","",""
"988688611597766707","jackh1#6251","05-Aug-22 09:08 PM","Queen Victoria","",""
"836939632892706887","LePixel#0242","05-Aug-22 09:08 PM","Im not from UK so my culture isn't good","",""
"836939632892706887","LePixel#0242","05-Aug-22 09:08 PM","Thx","",""
"811990176528072756","stainingdream#9170","05-Aug-22 09:09 PM","Join the quite voice chat","",""
"811990176528072756","stainingdream#9170","05-Aug-22 09:09 PM","It’s clue 1 discussion","",""
"246725187737747456","twinightcreep0#0098","05-Aug-22 09:09 PM","how does that relate to the fact? @Gunther","",""
"836939632892706887","LePixel#0242","05-Aug-22 09:10 PM","I can't right now","",""
"1004912146578145340","Gunther#6943","05-Aug-22 09:11 PM","Because it's fictional","",""
"988688611597766707","jackh1#6251","05-Aug-22 09:35 PM","Has anyone tryed a sound diagram","",""
"235490390483009539","Lupine#7675","05-Aug-22 09:36 PM","you don't need that","",""
"235490390483009539","Lupine#7675","05-Aug-22 09:36 PM","he explicitly said in the video's comments that understanding English and maybe doing a bit of googling is ALL you need","",""
"235490390483009539","Lupine#7675","05-Aug-22 09:37 PM","- No special knowledge is required to end up holding that beautiful fish in your hands.  All you need is to be able to understand the English language and perhaps a bit of web searching.","",""
"235490390483009539","Lupine#7675","05-Aug-22 09:37 PM","","https://cdn.discordapp.com/attachments/1004807711709470821/1005197833076478033/unknown.png",""
"988688611597766707","jackh1#6251","05-Aug-22 09:37 PM","Bruh","",""
"988688611597766707","jackh1#6251","05-Aug-22 09:37 PM","So","",""
"988688611597766707","jackh1#6251","05-Aug-22 09:37 PM","We already won ?","",""
"988688611597766707","jackh1#6251","05-Aug-22 09:37 PM","Cause we’ve already solved it","",""
"235490390483009539","Lupine#7675","05-Aug-22 09:37 PM","I don't feel richer","",""
"64379605808590848","Atral#7130","05-Aug-22 09:37 PM","Oh so no red herrings, interesting","",""
"64379605808590848","Atral#7130","05-Aug-22 09:38 PM","Is this  a recent edit?","",""
"235490390483009539","Lupine#7675","05-Aug-22 09:38 PM","says 5/8","",""
"235490390483009539","Lupine#7675","05-Aug-22 09:38 PM","so today, but dunno how old","",""
"988688611597766707","jackh1#6251","05-Aug-22 09:38 PM","You make a tiktok video saying “in the name of max fosh dish out the fish” in a high pitch voice while dancing and then you tag Courtney act","",""
"988688611597766707","jackh1#6251","05-Aug-22 09:38 PM","@GEbb4","",""
"64379605808590848","Atral#7130","05-Aug-22 09:39 PM","I can't even see the comment on the video 🤔","",""
"246725187737747456","twinightcreep0#0098","05-Aug-22 09:39 PM","neither 🤔","",""
"235490390483009539","Lupine#7675","05-Aug-22 09:41 PM","it's like 15 comments down","",""
"64379605808590848","Atral#7130","05-Aug-22 09:41 PM","ive scrolled through like 200 comments","",""
"235490390483009539","Lupine#7675","05-Aug-22 09:42 PM","","https://cdn.discordapp.com/attachments/1004807711709470821/1005199022883098704/unknown.png",""
"64379605808590848","Atral#7130","05-Aug-22 09:42 PM","doesn't show up for me at all","",""
"64379605808590848","Atral#7130","05-Aug-22 09:42 PM","I see james smith's one","",""
"246725187737747456","twinightcreep0#0098","05-Aug-22 09:42 PM","oh i found it @Atral","",""
"246725187737747456","twinightcreep0#0098","05-Aug-22 09:42 PM","it's there","",""
"235490390483009539","Lupine#7675","05-Aug-22 09:43 PM","dude I can't believe you are wasting time thinking I'm trying to troll you jeez","",""
"246725187737747456","twinightcreep0#0098","05-Aug-22 09:43 PM","","https://cdn.discordapp.com/attachments/1004807711709470821/1005199273127858216/Screen_Shot_2022-08-05_at_20.42.51.png",""
"64379605808590848","Atral#7130","05-Aug-22 09:43 PM","people have been posting trolls since it started can you blame me","",""
"235490390483009539","Lupine#7675","05-Aug-22 09:43 PM","fair enough","",""
"64379605808590848","Atral#7130","05-Aug-22 09:43 PM","anyway I want to find it in case he edits again","",""
"235490390483009539","Lupine#7675","05-Aug-22 09:43 PM","true","",""
"64379605808590848","Atral#7130","05-Aug-22 09:44 PM","oh i finally found it nice","",""
"235490390483009539","Lupine#7675","05-Aug-22 09:46 PM","""with the possibility"" sounds like another way of saying chance","",""
"235490390483009539","Lupine#7675","05-Aug-22 09:46 PM","can't think of a connection between chance and other ways of saying packed world or full world","",""
"64379605808590848","Atral#7130","05-Aug-22 09:48 PM","Someone had a good idea in the general chat that ""Dance in a crazy way"" = Rave","",""
"875595265745231882","JustCallMeNick#4096","05-Aug-22 09:48 PM","https://soundcloud.com/mxc10827/max-fosh-zocial-butterfly","",""
"138728252511485952","SirSouthwest#2108","05-Aug-22 10:07 PM","Dance in a crazy way - Thrash","",""
"138728252511485952","SirSouthwest#2108","05-Aug-22 10:07 PM","Or Dance in a crazy way = caned","",""
"138728252511485952","SirSouthwest#2108","05-Aug-22 10:07 PM","Dance (Anagram)","",""
"235490390483009539","Lupine#7675","05-Aug-22 10:11 PM","One thing that bothers me is, why is ""Post on TikTok videos?"" the only line with a question?","",""
"235490390483009539","Lupine#7675","05-Aug-22 10:11 PM","it doesn't even sound questionny on the song","",""
"158854267355004928","MrDKOz#5383","05-Aug-22 10:11 PM","There are two lines that are questions.","",""
"235490390483009539","Lupine#7675","05-Aug-22 10:11 PM","sorry, true","",""
"1005204170250403913","mattnewell#3604","05-Aug-22 10:11 PM","and neither of them need question marks","",""
"1005204170250403913","mattnewell#3604","05-Aug-22 10:12 PM","suggesting a link between those lines","",""
"1005204170250403913","mattnewell#3604","05-Aug-22 10:12 PM","the other line is ""exactly who to ask and how?""","",""
"158854267355004928","MrDKOz#5383","05-Aug-22 10:12 PM","Something I noticed that may be nothing, but there are 2 lines with commas, 2 lines with apostrophe's, and two lines with question marks.,","",""
"235490390483009539","Lupine#7675","05-Aug-22 10:13 PM","also most lines are monosyllabic but I dunno if he would play with that again, he did so in the past","",""
"165658906100498434","meliwazhere#6126","05-Aug-22 10:15 PM","could ""TikTok"" refer to Kesha's song? and he wants us to comment on the video?","",""
"1005204170250403913","mattnewell#3604","05-Aug-22 10:15 PM","it's not gonna be something as simple as that realistically","",""
"64379605808590848","Atral#7130","05-Aug-22 10:16 PM","probably nothing but worth exploring","",""
"158854267355004928","MrDKOz#5383","05-Aug-22 10:17 PM","Agreed.","",""
"64379605808590848","Atral#7130","05-Aug-22 10:17 PM","Any thoughts on 'No need to spam or guess **or stir things up**'?","",""
"64379605808590848","Atral#7130","05-Aug-22 10:18 PM","spam and guess read like instructions but stir things up seems like it could be a clue","",""
"681621649258577964","jgawesome#7102","05-Aug-22 10:19 PM","Yeah, also in the captions there is an extra “up” which isn’t sung","",""
"263703743411912707","volt64bolt#2496","05-Aug-22 10:19 PM","could be like digging up old stuff","",""
"263703743411912707","volt64bolt#2496","05-Aug-22 10:19 PM","the typos were debunked i think","","👍 (2)"
"681621649258577964","jgawesome#7102","05-Aug-22 10:19 PM","Ok","",""
"327848238092910593","ObsidianHoax#2049","05-Aug-22 10:20 PM","any further ideas on how the song ""showing"" us helps solve?","",""
"394874082618769409","ollie#3373","05-Aug-22 10:20 PM","disagree, i think ""no need to...stir things up"" just suggests that theres no anagrams (or similar puzzles) involved","",""
"64379605808590848","Atral#7130","05-Aug-22 10:20 PM","oh possibly","",""
"469970820404609041","GEbb4#0001","05-Aug-22 10:20 PM","It's usually used in cryptic stuff to mean there's an anagram, so I'd say the rest of that line contains an anagram","","😩 (1)"
"394874082618769409","ollie#3373","05-Aug-22 10:20 PM","or in other words, the answer will present itself to you","",""
"263703743411912707","volt64bolt#2496","05-Aug-22 10:21 PM","are you also searching for it?","",""
"270833265898815498","Skotte#5170","05-Aug-22 10:21 PM","bro still spreading red herrings","",""
"327848238092910593","ObsidianHoax#2049","05-Aug-22 10:22 PM","he really likes using synonyms.
 bus neighbour = rider/passenger. 
dear old queen = Victoria.
world is packed = ???","",""
"263703743411912707","volt64bolt#2496","05-Aug-22 10:22 PM","globe","",""
"263703743411912707","volt64bolt#2496","05-Aug-22 10:22 PM","flat earthers","",""
"263703743411912707","volt64bolt#2496","05-Aug-22 10:23 PM","the flat earth society","",""
"263703743411912707","volt64bolt#2496","05-Aug-22 10:23 PM","THE EDGE OF THE EARTH","",""
"263703743411912707","volt64bolt#2496","05-Aug-22 10:23 PM","ITS AT AREA [whatever it is here]","",""
"836939632892706887","LePixel#0242","05-Aug-22 10:23 PM","I'm looking at queen Victoria street to see if there is anything that can relate to the music","",""
"64379605808590848","Atral#7130","05-Aug-22 10:25 PM","the neighbour of the bus is the train and the dear old queen is victoria / elizabeth so victoria / elizabeth line","",""
"263703743411912707","volt64bolt#2496","05-Aug-22 10:25 PM","or is it queer old dean","",""
"263703743411912707","volt64bolt#2496","05-Aug-22 10:26 PM","so drag","",""
"235490390483009539","Lupine#7675","05-Aug-22 10:26 PM","hey wait a sec
https://www.tiktok.com/@maxfosh/video/7128407536570600709?is_copy_url=1&is_from_webapp=v1","",""
"235490390483009539","Lupine#7675","05-Aug-22 10:26 PM","on the tik tok there are no typos?","",""
"263703743411912707","volt64bolt#2496","05-Aug-22 10:26 PM","exactly","",""
"263703743411912707","volt64bolt#2496","05-Aug-22 10:27 PM","the typos are debunked","",""
"235490390483009539","Lupine#7675","05-Aug-22 10:27 PM","I see, I'm late to the party","",""
"235490390483009539","Lupine#7675","05-Aug-22 10:27 PM","carry on 😅","",""
"235490390483009539","Lupine#7675","05-Aug-22 10:28 PM","""Just copy what this silly song shows"" is a very curious way of saying something","",""
"235490390483009539","Lupine#7675","05-Aug-22 10:28 PM","why ""shows""","",""
"64379605808590848","Atral#7130","05-Aug-22 10:28 PM","I don't think that necessarily means the typos aren't relevant, it could be highlighting the differences just as much as its debunking them","",""
"761664600571379785","flyingdutchboy1#1415","05-Aug-22 10:29 PM","I agree with the Victoria train line Elizabeth line thoughts.
Aboard Victoria is what I took from that line

Its the next line that's difficult","",""
"327848238092910593","ObsidianHoax#2049","05-Aug-22 10:29 PM","I have tried hours of what3words for piano.humans.fish, fish.piano.whites, shirt,piano,fish. etc etc etm","",""
"761664600571379785","flyingdutchboy1#1415","05-Aug-22 10:30 PM","I really do think it's a website or Instagram page or tiktok page","",""
"64379605808590848","Atral#7130","05-Aug-22 10:31 PM","yeah I thought so too","",""
"64379605808590848","Atral#7130","05-Aug-22 10:31 PM","Neighbours is a show 🤷🏻‍♂️","",""
"235490390483009539","Lupine#7675","05-Aug-22 10:32 PM","Do you think he would use 3words again when it was the way to win last time? Doesn't seem like the kind of guy to repeat a gimmick","",""
"761664600571379785","flyingdutchboy1#1415","05-Aug-22 10:32 PM","It's worth watching this video, I'm quietly confident that this guy is who wrote the last treasure hunt with max himself","",""
"761664600571379785","flyingdutchboy1#1415","05-Aug-22 10:32 PM","https://youtu.be/q7Lfv-Z6sho","",""
"64379605808590848","Atral#7130","05-Aug-22 10:33 PM","hope not but can't rule it out","",""
"327848238092910593","ObsidianHoax#2049","05-Aug-22 10:33 PM","What does the silly song show? ""watching the vid""?
Fish
White
Walls
Piano
Humans
Goldfish
Rhyme
Meter
Rhythm?","",""
"235490390483009539","Lupine#7675","05-Aug-22 10:33 PM","Fosho, takes a second to try anyway","",""
"761664600571379785","flyingdutchboy1#1415","05-Aug-22 10:33 PM","It's not Rick roll, it's Cracking the Cryptic","",""
"235490390483009539","Lupine#7675","05-Aug-22 10:33 PM","Maybe if you leave out all the words that are not monosyllabic?","",""
"235490390483009539","Lupine#7675","05-Aug-22 10:34 PM","what the silly song shows = what the syllables show?","",""
"456226577798135808","Deleted User#0000","05-Aug-22 10:38 PM","one sec im downloading audacity to see 'what the song shows'","",""
"456226577798135808","Deleted User#0000","05-Aug-22 10:39 PM","nvm","",""
"327848238092910593","ObsidianHoax#2049","05-Aug-22 10:39 PM","looks normal on audacity to me","",""
"235490390483009539","Lupine#7675","05-Aug-22 10:40 PM","nah remember he did say you just need to understand english and maybe google","",""
"235490390483009539","Lupine#7675","05-Aug-22 10:40 PM","so it can't involve something like that","","👍 (2)"
"327848238092910593","ObsidianHoax#2049","05-Aug-22 10:41 PM","exactly","",""
"64379605808590848","Atral#7130","05-Aug-22 10:42 PM","Fair to assume you don't have to any technical analysis","",""
"235490390483009539","Lupine#7675","05-Aug-22 10:44 PM","``
exactly
precious
Neighbour 
possibility
keeper secret 
beyond
crazy squeaky
TikTok videos?
copy silly 
``","",""
"235490390483009539","Lupine#7675","05-Aug-22 10:44 PM","those are the non-monosyllabic words","",""
"235490390483009539","Lupine#7675","05-Aug-22 10:45 PM","wonder if they show anything","",""
"235490390483009539","Lupine#7675","05-Aug-22 10:46 PM","```
3
2
2
5
2 2
2
2 2
2 3
2 2
```","",""
"235490390483009539","Lupine#7675","05-Aug-22 10:46 PM","I'm not getting anything out of this so I'm gonna cook some dinner, good luck!","",""
"599481160489500685","Calvin#0560","05-Aug-22 10:46 PM","Exactly
precious
Neighbour
possibility
keeper 
secret
beyond
crazy 
squeaky
TikTok 
videos?
copy
silly","",""
"64379605808590848","Atral#7130","05-Aug-22 10:47 PM","Why these words?","",""
"1005204170250403913","mattnewell#3604","05-Aug-22 10:47 PM","anyone think ""the world is packed"" could be referencing the globe theatre?","",""
"263703743411912707","volt64bolt#2496","05-Aug-22 10:47 PM",".","",""
"263703743411912707","volt64bolt#2496","05-Aug-22 10:47 PM","read bro","",""
"158854267355004928","MrDKOz#5383","05-Aug-22 10:47 PM","They have >1 syllable","",""
"235490390483009539","Lupine#7675","05-Aug-22 10:48 PM","it seems curious that there are so many 1 syllable words, so we're seeing if the other ones show anything","",""
"280901076759347200","Uve_got_AIDS#4008","05-Aug-22 10:49 PM","Do you try the inverse? Just the 1 syllable words?","",""
"64379605808590848","Atral#7130","05-Aug-22 10:49 PM","I think 1 syllable words are just much more common than multi-syllable but its worth bearing in mind in case its relevant","",""
"158854267355004928","MrDKOz#5383","05-Aug-22 10:54 PM","If you do a case insensitive character count of the song lyrics, it spells out `TOES` in the correct order, when you do a case sensitive character count it's `otes`.","","🧠 (1)"
"64379605808590848","Atral#7130","05-Aug-22 10:55 PM","you have to send feet pics to get the fish","",""
"327848238092910593","ObsidianHoax#2049","05-Aug-22 10:56 PM","there is a song by the band ""toe"" called Song silly","",""
"327848238092910593","ObsidianHoax#2049","05-Aug-22 10:56 PM","already looked into it","",""
"158854267355004928","MrDKOz#5383","05-Aug-22 10:56 PM","I'm assuming nothing came from it?","",""
"327848238092910593","ObsidianHoax#2049","05-Aug-22 10:56 PM","https://www.youtube.com/watch?v=O1dtTVQQZTc","",""
"327848238092910593","ObsidianHoax#2049","05-Aug-22 10:57 PM","169,087 views
Jul 21, 2015
https://www.toe.st/","",""
"327848238092910593","ObsidianHoax#2049","05-Aug-22 10:57 PM","nothing that means anything to me","",""
"270833265898815498","Skotte#5170","05-Aug-22 10:58 PM","Has anyone looked into what he is ""saying"" at 4:30","",""
"158854267355004928","MrDKOz#5383","05-Aug-22 10:58 PM","Well even if this isn't a clue, loving the song.","","🤭 (1)"
"327848238092910593","ObsidianHoax#2049","05-Aug-22 11:02 PM","""wieeko""","","upvote (1)"
"270833265898815498","Skotte#5170","05-Aug-22 11:02 PM","Huh","",""
"327848238092910593","ObsidianHoax#2049","05-Aug-22 11:03 PM","no really it looks like ""here we go""","",""
"270833265898815498","Skotte#5170","05-Aug-22 11:05 PM","Ya kinda","",""
"327848238092910593","ObsidianHoax#2049","05-Aug-22 11:09 PM","","https://cdn.discordapp.com/attachments/1004807711709470821/1005220996497821726/unknown.png",""
"270833265898815498","Skotte#5170","05-Aug-22 11:10 PM","five days ago though, why would she be important?","",""
"327848238092910593","ObsidianHoax#2049","05-Aug-22 11:11 PM","","https://cdn.discordapp.com/attachments/1004807711709470821/1005221417090035813/unknown.png",""
"327848238092910593","ObsidianHoax#2049","05-Aug-22 11:11 PM","it's just weird.","",""
"270833265898815498","Skotte#5170","05-Aug-22 11:12 PM","i cant see how she would be connected to the riddle though","",""
"270833265898815498","Skotte#5170","05-Aug-22 11:13 PM","other than Tiktok","",""
"327848238092910593","ObsidianHoax#2049","05-Aug-22 11:14 PM","""Just use my vid to find out""
TikTok vid
Fishlover

thats it","",""
"270833265898815498","Skotte#5170","05-Aug-22 11:22 PM","I think its a reach","",""
"270833265898815498","Skotte#5170","05-Aug-22 11:25 PM","The answer to the riddle should be obvious when solved","",""
"318649930371563520","Hyperterdle6#7817","05-Aug-22 11:25 PM","this is more of a stretch than the piano hinge","",""
"263703743411912707","volt64bolt#2496","05-Aug-22 11:26 PM","this piano hinge?","https://cdn.discordapp.com/attachments/1004807711709470821/1005225200440315994/unknown.png","🤣 (1)"
"263703743411912707","volt64bolt#2496","05-Aug-22 11:26 PM","i think its not a stretch","",""
"263703743411912707","volt64bolt#2496","05-Aug-22 11:26 PM","its a squish","",""
"327848238092910593","ObsidianHoax#2049","05-Aug-22 11:26 PM","hahahah","",""
"773635926349971456","Ollie5050#0887","05-Aug-22 11:26 PM","Which is why I’m trying to just take it literally","",""
"356187409412784129","The One Who Watches#9547","05-Aug-22 11:27 PM","What text is that","",""
"263703743411912707","volt64bolt#2496","05-Aug-22 11:28 PM","it was on the fish","",""
"356187409412784129","The One Who Watches#9547","05-Aug-22 11:28 PM","I highly doubt the clue is hidden in unseeable text reflected off the fish","",""
"263703743411912707","volt64bolt#2496","05-Aug-22 11:28 PM","its cia enhanced","",""
"263703743411912707","volt64bolt#2496","05-Aug-22 11:28 PM","very smart tech","",""
"356187409412784129","The One Who Watches#9547","05-Aug-22 11:28 PM","no someone copy and pasted that text there","",""
