AuthorID,Author,Date,Content,Attachments,Reactions
"263703743411912707","volt64bolt#2496","06-Aug-22 11:37 AM","That’s the how part","",""
"64379605808590848","Atral#7130","06-Aug-22 11:38 AM","the keeper of the secret is also ""not close to max""","",""
"64379605808590848","Atral#7130","06-Aug-22 11:38 AM","but that might not be literal","",""
"591001462213967935","Geodim#6435","06-Aug-22 11:38 AM","does the ""one clue"" thing mean that we will not for example find a video which points us somewhere else?","",""
"64379605808590848","Atral#7130","06-Aug-22 11:39 AM","Not necessarily but probably","",""
"591001462213967935","Geodim#6435","06-Aug-22 11:39 AM","if so then it is all about watching the video and contacting someone","",""
"64379605808590848","Atral#7130","06-Aug-22 11:39 AM","That's what I think","",""
"64379605808590848","Atral#7130","06-Aug-22 11:39 AM","and I think the song is the only part of the video that's relevant","","👍 (2)"
"591001462213967935","Geodim#6435","06-Aug-22 11:39 AM","idk though it seems too simple","",""
"64379605808590848","Atral#7130","06-Aug-22 11:40 AM","its not because the riddle will be really obscure","",""
"591001462213967935","Geodim#6435","06-Aug-22 11:40 AM","ok","",""
"591001462213967935","Geodim#6435","06-Aug-22 11:40 AM","i was hoping for a cicada styled arg thing bcs its fun","",""
"64379605808590848","Atral#7130","06-Aug-22 11:41 AM","```
Darling tonight let us dine
on Moghul dishes so fine
three courses with wine
the first sounds divine
```
This is from the last hunt, the solution was ""lentil"". Even after being told it, can you see it?","",""
"591001462213967935","Geodim#6435","06-Aug-22 11:41 AM","Obviously","",""
"591001462213967935","Geodim#6435","06-Aug-22 11:41 AM","not","",""
"64379605808590848","Atral#7130","06-Aug-22 11:41 AM","Yeah","",""
"591001462213967935","Geodim#6435","06-Aug-22 11:41 AM","💀","",""
"394874082618769409","ollie#3373","06-Aug-22 11:41 AM","yes lol","",""
"357592214433562647","pluto#1519","06-Aug-22 11:42 AM","I can’t see it I’m curious how u find lentil","",""
"394874082618769409","ollie#3373","06-Aug-22 11:42 AM","""the first sound"" > darl > moghul dishes (indian cuisine) > dahl > lentil dahl","",""
"773635926349971456","Ollie5050#0887","06-Aug-22 11:44 AM","And the red herring was Darlington (the place) iirc","",""
"64379605808590848","Atral#7130","06-Aug-22 11:45 AM","this, pretty abstract lets be honest","",""
"64379605808590848","Atral#7130","06-Aug-22 11:45 AM","especially the jump from dahl -> lentil","",""
"469970820404609041","GEbb4#0001","06-Aug-22 11:46 AM","dahl means lentil in Indian cuisine, hence ""Moghul"" to help make that link","",""
"64379605808590848","Atral#7130","06-Aug-22 11:46 AM","you could just as easily pick any other ingredient of Dahl, or Roald Dahl or a number of other things","",""
"591001462213967935","Geodim#6435","06-Aug-22 11:46 AM","true","",""
"469970820404609041","GEbb4#0001","06-Aug-22 11:46 AM","Hence why we keep saying ""it's probably wordplay""","","👍 (1)"
"64379605808590848","Atral#7130","06-Aug-22 11:47 AM","It's almost confirmed as wordplay by the ""no need to mix things up"" line","",""
"64379605808590848","Atral#7130","06-Aug-22 11:48 AM","implying no ciphers or anagrams","",""
"199218077412360192","DeepStatic#0751","06-Aug-22 11:52 AM","Of course it's wordplay. In fact what we really need here is a channel solely for wordplay/cryptic analysis.","","👍 (3)"
"469970820404609041","GEbb4#0001","06-Aug-22 11:54 AM","The problem with that would be keeping it on topic 😄","","👍 (1)"
"242870833310203905","Pico#8428","06-Aug-22 11:57 AM","these whole channels are for analysis","",""
"242870833310203905","Pico#8428","06-Aug-22 11:58 AM","think if you made a channel for that specifically it'd be interpreted as a clue","",""
"199218077412360192","DeepStatic#0751","06-Aug-22 12:56 PM","If you farted strangely it would be interpreted as a clue right now.","",""
"720329906784960512","sneugelstroof#5561","06-Aug-22 01:26 PM","""neighbour on the bus or a dear old queen"" what if it's just ""coach"" ?","",""
"720329906784960512","sneugelstroof#5561","06-Aug-22 01:26 PM","victoria coach station (famous enough that if I inputted it into a crossword solver it gave me ""coach"" as answer for ""victoria"" - the dear old queen), and a bus and a coach are neighbours on the road?","",""
"968834798804156416","joshsil03#9110","06-Aug-22 01:32 PM","coachella ? Long shot","",""
"270833265898815498","Skotte#5170","06-Aug-22 01:37 PM","Complete homerun","",""
"722584589729792040","neonllama#0626","06-Aug-22 02:08 PM","I like that thinking! The word I got from this line is “border” (neighbour is the definition, sounds like “board” the bus with  queen adding the “ER”)","",""
"720329906784960512","sneugelstroof#5561","06-Aug-22 02:08 PM","oh that's very good too","",""
"199218077412360192","DeepStatic#0751","06-Aug-22 02:27 PM","I'm sure Neighbour is a cryptic indicator for 'put next to', and 'with' is the separator. 
**neighbour**[word meaning both 'on the bus' and 'dear old queen'] **with** the possibility(...)","",""
"199218077412360192","DeepStatic#0751","06-Aug-22 02:29 PM","Which is annoying because it ruins what I thought of the next bit:
'with the possibility' means (""The""+[word meaning possibility]) contains a word meaning 'world'","","💯 (2)"
"790602272760528947","MouseBearMan#1788","06-Aug-22 03:05 PM","https://www.crosswordgenius.com/guide-to-cryptic-crosswords/","",""
"790602272760528947","MouseBearMan#1788","06-Aug-22 03:06 PM","https://crosswordgenius.com/clue/bulls-neighbour-has-meal-first-off","",""
"790602272760528947","MouseBearMan#1788","06-Aug-22 03:07 PM","The latter is just a ""great"" example for the use of neighbour in a cryptic crossword","",""
"127879348463075338","Them#5529","06-Aug-22 03:22 PM","The problem is figuring out words for neighbour on a bus that fit","",""
"127879348463075338","Them#5529","06-Aug-22 03:23 PM","I doubt seatmate cause thats an american thing, but even if it was it doesnt fit any attempts I've tried","",""
"64379605808590848","Atral#7130","06-Aug-22 04:14 PM","leaking classified information smh","",""
"64379605808590848","Atral#7130","06-Aug-22 04:15 PM","not sure about the ""with"" part tbh but I do think neighbour is a cryptic indicator","",""
"195562277405982720","Turtle#3383","06-Aug-22 04:39 PM","By this logic ""in a crazy way"" is a cryptic indicator but it says not to stir things up :/","",""
"746325517363445861","Oli#7963","06-Aug-22 04:39 PM","A word meaning world meaning planet which is odd as he commented on a tok tok yesterday saying something about blue plannet and David Attenborough","",""
"746325517363445861","Oli#7963","06-Aug-22 04:41 PM","As well as this David is friends to the queen and could be considered next to her as in neighbour","",""
"877416472413102090","x13hurt#3312","06-Aug-22 04:44 PM","Cryptic crossword idea sounds great","",""
"195562277405982720","Turtle#3383","06-Aug-22 04:48 PM","Dance in a crazy way = ""acned"" ""caned""","",""
"339794125610287125","RobPlaysMinecraft#1403","06-Aug-22 04:48 PM","Neighbour also looks suspicious because it’s not “a neighbour” but it is “a dear old queen”. Why would one have an article and not the other?","",""
"195562277405982720","Turtle#3383","06-Aug-22 04:48 PM","Acned fits with squeaky voice and someone who might post on tiktok videos (hence the cryptic '?')","",""
"339794125610287125","RobPlaysMinecraft#1403","06-Aug-22 04:49 PM","“Dance in a” is an anagram of canadien","",""
"496737449217753099","Ziggothy#5803","06-Aug-22 04:49 PM","Which means?","",""
"195562277405982720","Turtle#3383","06-Aug-22 04:49 PM","That's ' Canadian' tho","",""
"339794125610287125","RobPlaysMinecraft#1403","06-Aug-22 04:50 PM","Apparently it’s the French spelling of Canadian, and there are parts of Canada that speak French","",""
"339794125610287125","RobPlaysMinecraft#1403","06-Aug-22 04:50 PM","A bit if a long shot but possibly worth mentioning","",""
"790602272760528947","MouseBearMan#1788","06-Aug-22 04:56 PM","A little off-topic, but can somebody explain to me the answer to 6 across: https://www.theguardian.com/crosswords/cryptic/27888#6-across","",""
"387552714017603585","Omichromium#8008","06-Aug-22 05:02 PM","Canadien is the username that the terraria youtuber wand of sparking uses lmao","",""
"195562277405982720","Turtle#3383","06-Aug-22 05:07 PM","@MouseBearMan it's the answer to 26a with the s removed","","👍 (1)"
"911737286243270747","ButterdBread#2823","06-Aug-22 05:23 PM","could “on the bus or a dear old queen” translate to “a border” which is then neighboured with the second part?
on the bus = aboard, dear old queen = ER elizabeth regent, the or in between acting as a confirmer of the sound “or”","",""
"127879348463075338","Them#5529","06-Aug-22 05:26 PM","the problem Im seeing is no one has publically come out with any plausable answers to the possibility line","","👍 (1)"
"127879348463075338","Them#5529","06-Aug-22 05:26 PM","so its impossible to check anything from the first sentence","",""
"387552714017603585","Omichromium#8008","06-Aug-22 05:34 PM","My only thing i got from that is that the letters that ""the possibility"" and ""the world"" share are theol","",""
"387552714017603585","Omichromium#8008","06-Aug-22 05:35 PM","Bc like with the possibility the world is packed","",""
"790602272760528947","MouseBearMan#1788","06-Aug-22 05:37 PM","abutter?","https://cdn.discordapp.com/attachments/1004807711709470821/1005499767205412864/ross_abutter.png",""
"127879348463075338","Them#5529","06-Aug-22 05:38 PM","AI clearly isnt there yet","",""
"387552714017603585","Omichromium#8008","06-Aug-22 05:38 PM","Oh my god","",""
"387552714017603585","Omichromium#8008","06-Aug-22 05:38 PM","WAIT","",""
"387552714017603585","Omichromium#8008","06-Aug-22 05:38 PM","OPENAI PLAYGROUND","",""
"790602272760528947","MouseBearMan#1788","06-Aug-22 05:39 PM","Not a native speaker, so I have a little trouble dealing some of the more obscure words in this kind of puzzle","",""
"387552714017603585","Omichromium#8008","06-Aug-22 05:39 PM","CONFIRMED GUYS","https://cdn.discordapp.com/attachments/1004807711709470821/1005500460288983120/Screenshot_20220807-013941_Chrome.jpg",""
"195562277405982720","Turtle#3383","06-Aug-22 05:40 PM","Thing is, if they were true crossword cryptics, there's too many words. Unless the additional words are for rhythm and rhyme","",""
"127879348463075338","Them#5529","06-Aug-22 05:40 PM","thats an AIs guess at the clue, which is mostly based off a previously clue that had neighbour in it","",""
"127879348463075338","Them#5529","06-Aug-22 05:40 PM","abutter is a word for neighbour but it doesnt connect to the queen part","",""
"790602272760528947","MouseBearMan#1788","06-Aug-22 05:41 PM","https://www.thefreedictionary.com/abutter Those definitions make it seem at least kind of reasonable, though. IMO","",""
"790602272760528947","MouseBearMan#1788","06-Aug-22 05:42 PM","https://www.merriam-webster.com/dictionary/abutter ""abutter : one that abuts : specifically : the owner of a contiguous property""","",""
"444853610057302028","Towns#5670","06-Aug-22 05:47 PM","lemme get dall-e","",""
"444853610057302028","Towns#5670","06-Aug-22 05:47 PM","","https://cdn.discordapp.com/attachments/1004807711709470821/1005502491623968818/unknown.png",""
"444853610057302028","Towns#5670","06-Aug-22 05:47 PM","Cax","",""
"444853610057302028","Towns#5670","06-Aug-22 05:48 PM","Map Flaxi","",""
"127879348463075338","Them#5529","06-Aug-22 05:52 PM","try running the keeper of secret line through it and see what comes up","",""
"790602272760528947","MouseBearMan#1788","06-Aug-22 05:56 PM","obviously wrong, but I find the interpretation for the last words still fascinating:
'but the keeper of the secret is not' is the definition.
I can't judge whether this definition defines the answer.
'close to max' is the wordplay.
'close' becomes 'end' (I've seen this before).
'to max' becomes 'most' (I've seen this in another clue).
'end'+'most'='ENDMOST'","",""
"237715381593047044","Marisa#6054","06-Aug-22 06:01 PM","https://www.bilibili.com/video/BV18e4y1D78z?vd_source=8ad5afd3eff92b6bd44d38b0f4ad0639","",""
"270833265898815498","Skotte#5170","06-Aug-22 06:01 PM","aint trusting that link","",""
"433621333880864790","Strick#8905","06-Aug-22 06:02 PM","It's legit, videos been uploaded to a site that works around Chinese censorship","",""
"270833265898815498","Skotte#5170","06-Aug-22 06:03 PM","Ohhh okay, makes sense","",""
"64379605808590848","Atral#7130","06-Aug-22 06:04 PM","Had a line of reasoning similar to this, using ER for queen","",""
"64379605808590848","Atral#7130","06-Aug-22 06:05 PM","Different answer though","",""
"127879348463075338","Them#5529","06-Aug-22 06:05 PM","Most of the answers of on a bus work with ER added to the end","",""
"127879348463075338","Them#5529","06-Aug-22 06:06 PM","like I said we really need plausable answers to the other lines to be able to go any further I think with the first one","",""
"383377580524306465","Plornt#6903","06-Aug-22 06:06 PM","What are they talking about IP in the comments? in that chinese reupload. Any merit there or something people have already figured out is rubbish?","https://cdn.discordapp.com/attachments/1004807711709470821/1005507186203561984/unknown.png",""
"263703743411912707","volt64bolt#2496","06-Aug-22 06:07 PM","its rubbish","",""
"263703743411912707","volt64bolt#2496","06-Aug-22 06:07 PM","""abroad i cant open the intranet"" except they posted that on the internet","",""
"383377580524306465","Plornt#6903","06-Aug-22 06:08 PM","I mean, depends, China is very locked down when it comes to the internet so potentially they can access that page but not others but then fairly certain everyone has VPNs anyways. In any case you could make an IP out of anything if you try 😛","",""
"212020468008484864","Bd09live#1901","06-Aug-22 06:10 PM","well it said you only need to have knowledge of english language and maybe a little googling...not needing to know how music works","","upvote (1)"
"263703743411912707","volt64bolt#2496","06-Aug-22 06:10 PM","exactly","",""
"383377580524306465","Plornt#6903","06-Aug-22 06:11 PM","True","",""
"339794125610287125","RobPlaysMinecraft#1403","06-Aug-22 06:11 PM","“With the possibility the world is packed” could be BOTHER. Take THE, pack it in an anagram (possibility) of World aka ORB and you get BOTHER","",""
"64379605808590848","Atral#7130","06-Aug-22 06:15 PM","it doesn't work like that, its like a blacklist of sites you can't visit rather than a whitelist of ones you can't. Also most people don't have a VPN","",""
"64379605808590848","Atral#7130","06-Aug-22 06:15 PM","But pretty sure that IP stuff is complete rubbish","","upvote (2)"
"790602272760528947","MouseBearMan#1788","06-Aug-22 06:20 PM","I'm trying to think ahead a little. Once we ""solved"" the wordplay we will most likely need to use it in some other context. Either searching for it on tiktok or _somewhere else_. Assuming it's not tiktok - for a sec - would require there to be a hint in the wordplay, either a website (IG, Twitter, Homepage, YT, or topleveldomain or ip (very unlikely)) something to keep in mind, potentially.","","✅ (1)"
"694189717692088421","warriorkingsk#2374","06-Aug-22 06:20 PM","I'm leaning towards an email rn","",""
"263703743411912707","volt64bolt#2496","06-Aug-22 06:21 PM","too simple","",""
"339794125610287125","RobPlaysMinecraft#1403","06-Aug-22 06:23 PM","Email address? could be a tongue and cheek comment about how max is far from a “Hot Male” aka Hotmail :p","",""
"263703743411912707","volt64bolt#2496","06-Aug-22 06:23 PM","ohhhhhhhh","",""
"263703743411912707","volt64bolt#2496","06-Aug-22 06:23 PM","you just wrecked him","",""
"339794125610287125","RobPlaysMinecraft#1403","06-Aug-22 06:23 PM","Ahahah only kidding :p","",""
"263703743411912707","volt64bolt#2496","06-Aug-22 06:24 PM","i would agree","",""
"790602272760528947","MouseBearMan#1788","06-Aug-22 06:25 PM","i find email almost impossible: you need at least 3 datums [username]@[url].[tld] plus an indicator, that it is - indeed - an email. Also makes for horrible cinematography: Max sitting in front of his laptop. ""Oh I have an E-Mail. Somebody must have solved it.""","",""
"263703743411912707","volt64bolt#2496","06-Aug-22 06:26 PM","at least people arent digging up the roundabout like last time","",""
"263703743411912707","volt64bolt#2496","06-Aug-22 06:26 PM","to my knowledge at least...","",""
"723248278464102473","Observer Ward#8231","06-Aug-22 06:29 PM","Or you need their email","",""
"195553303613014016","Wille#8716","06-Aug-22 06:43 PM","I mean either a url that says exactly what you must do or a phone number makes sense","",""
"790602272760528947","MouseBearMan#1788","06-Aug-22 06:48 PM","There will either be a hint in the wordplay, telling us which medium to use (url, mail, phone, app). Or it relates to tiktok. No need to guess.","",""
"195562277405982720","Turtle#3383","06-Aug-22 06:49 PM","if its tiktok im outta here","","👍 (5)"
"212020468008484864","Bd09live#1901","06-Aug-22 06:50 PM","thinking its going to be .world cause how many times he says world and caps it...like he is obbessed with it","",""
"790602272760528947","MouseBearMan#1788","06-Aug-22 06:52 PM","The search feature does not need a login and it's quite comprehensive. We could find an account with an obscure name this way, that has more information in it's description (url, etc.). This would still not need a login.","",""
"127879348463075338","Them#5529","06-Aug-22 06:52 PM","I hate the word world at this point","",""
"127879348463075338","Them#5529","06-Aug-22 06:52 PM","its smug aura mocks me charlie","",""
"592094921519792316","EmmaS#0894","06-Aug-22 07:09 PM","Just thinking about the way the line post on tiktok videos is written. Could it be a question about a post about tiktok like a news article rather than posting to the platform itself","",""
"689566779558985728","martheleanne#3746","06-Aug-22 07:11 PM","I was thinking it means the person you need to ask, has a tiktok account","",""
"790602272760528947","MouseBearMan#1788","06-Aug-22 07:12 PM","Without more infos deciphered all of this is a stab in the dark.","",""
"327848238092910593","ObsidianHoax#2049","06-Aug-22 07:34 PM","Neighbor on a bus is a seatmate.","",""
"195562277405982720","Turtle#3383","06-Aug-22 07:36 PM","is that an americanism?","",""
"195562277405982720","Turtle#3383","06-Aug-22 07:36 PM","never heard it","",""
"195562277405982720","Turtle#3383","06-Aug-22 07:37 PM","also its 'on THE bus' and the only thing i associate with that is wheels","",""
"127879348463075338","Them#5529","06-Aug-22 07:59 PM","yes its american","",""
"822831337168699422","ej_cam94#8662","06-Aug-22 08:19 PM","Seatmate - queen - chess- checkmate","",""
"263703743411912707","volt64bolt#2496","06-Aug-22 08:22 PM","i love chess","",""
"284110442257711117","Gianni#0162","06-Aug-22 08:24 PM","","https://cdn.discordapp.com/attachments/1004807711709470821/1005541887693820024/IMG-20220616-WA0000.jpeg","😼 (6),😍 (3)"
"576130164337934371","Bonnieelena#8480","06-Aug-22 08:25 PM","Finally, a cat picture","",""
"722025428763803740","twitchy#5252","06-Aug-22 08:26 PM","vacations.inclines.melodies","",""
"722025428763803740","twitchy#5252","06-Aug-22 08:26 PM","thats it","",""
"722025428763803740","twitchy#5252","06-Aug-22 08:26 PM","and","",""
"722025428763803740","twitchy#5252","06-Aug-22 08:26 PM","renegotiations.byplay.caseloads","",""
"754109906658918531","AlejandroLocoBoy#0885","06-Aug-22 09:29 PM","World. He always puts emphasis on *world*. In his updates (Everyone in the WORLD can join), in the actual clue, everywhere. If he says ""World"", and it relates to the hunt, *it gets **emphasized***","","✅ (11)"
"263703743411912707","volt64bolt#2496","06-Aug-22 09:32 PM","thats just his way of speaking i think","",""
"924476438235729981","lizllewop#7237","06-Aug-22 09:40 PM","But what if its a clue?","",""
"172428306346409984","DanDan#7773","07-Aug-22 12:19 AM","My interpretation...

Theme Setter Section/Instructions [
    “In the name of Max Fosh, dish out the fish”
    That’s all you need to spout
    Exactly who to ask and how?
    Just use my vid to find out
    To claim the precious trout
]

Actual Clue [
    Neighbour on the bus or a dear old queen (It could be anyone)
    With the possibility the world is packed (The world is full, so no room for the keeper of the secret)
    But the keeper of the secret is not close to Max (The keeper of the secret is not packed/maximum)
    And that’s beyond a fact (Undoubtedly the truth)

        // The keeper of the secret is a cryptic meaning for a Website, as there’s no room in the world for the keeper and the internet is not close to maximum capacity. Therefore the keeper of the secret (where the fish/how to get it) is a Website.

    Dance in a crazy way,
    use a squeaky voice
    Post on TikTok videos?

         // This section here is the only part of the song that will solve what the website is.
]

Confirmer, 
Did you get to the answer with no guessing, by chance or anagrams? Or just by using the song [
    No need to spam or guess or stir things up
    Just copy what this silly song shows
]","","upvote (4)"
"790602272760528947","MouseBearMan#1788","07-Aug-22 12:27 AM","Generally agreeable, but the keeper of the secret and the capacity stuff does not convince me.","","upvote (1)"
"379330895989047296","peachman1997#1255","07-Aug-22 12:35 AM","I noticed this","",""
"64379605808590848","Atral#7130","07-Aug-22 02:03 AM","is that in more than 2 places","",""
"64379605808590848","Atral#7130","07-Aug-22 02:03 AM","in the video its hard to say its even emphasised because its  a song","",""
"136625121308835840","Drew#5969","07-Aug-22 02:23 AM","He says “anyone in the world can [find the fish/win the fish]” in 3 places: yt desc, yt comment, and a tweet","",""
"784825209407799297","RoGarf#7848","07-Aug-22 03:01 AM","Could be wordplay with world or could be subtle hints to social media that is only accessible for some countries.","",""
"116292981656518656","Eternal#4263","07-Aug-22 03:04 AM","it has to be accessible in china, I read somewhere that the video is in china but without the advert in it","","👍 (4)"
"784825209407799297","RoGarf#7848","07-Aug-22 03:23 AM","Really? That's quite interesting","",""
"784825209407799297","RoGarf#7848","07-Aug-22 03:23 AM","So it really REALLY has to be accessible to everyone...","",""
"425406514782797831","Senzubean#3538","07-Aug-22 03:31 AM","What if: In the name of max fosh = maxfosh.co
And Dish out the fish =  forward slash + ths name of the fish

Or something like that? Anyone tried that already?","",""
"116292981656518656","Eternal#4263","07-Aug-22 03:34 AM","tried with underscores, hyphens, etc","",""
"116292981656518656","Eternal#4263","07-Aug-22 03:34 AM","I am trying to find the original source of video / claim","",""
"116292981656518656","Eternal#4263","07-Aug-22 03:36 AM","they exist but they usually work on the basis of scouring the accessible pages of the site and finding linked pages, rather than inputting random urls","",""
"425406514782797831","Senzubean#3538","07-Aug-22 03:38 AM","Could also be a txt file or smth doesnt have to be a folder","",""
"425406514782797831","Senzubean#3538","07-Aug-22 03:39 AM","Or php or smth","",""
"425406514782797831","Senzubean#3538","07-Aug-22 03:40 AM","I think there was a rule that anyone could find it and thus no special skills were necessary","",""
"136625121308835840","Drew#5969","07-Aug-22 03:40 AM","you could ping websites systematically but you would need  a lot of info before doing that to not be wasting time","",""
"425406514782797831","Senzubean#3538","07-Aug-22 03:43 AM","Could also be an email like goldfosh@maxfosh.co","",""
"826778531097870347","squarepx#1263","07-Aug-22 03:50 AM","deffo an option to explore","",""
"425406514782797831","Senzubean#3538","07-Aug-22 03:51 AM","https://www.maxfosh.co/store","",""
"425406514782797831","Senzubean#3538","07-Aug-22 03:52 AM","Url fuzzer found 4 folders /home /store  and 2 others that give 404s","",""
"425406514782797831","Senzubean#3538","07-Aug-22 03:52 AM","Idk","",""
"425406514782797831","Senzubean#3538","07-Aug-22 03:52 AM","XD","",""
"425406514782797831","Senzubean#3538","07-Aug-22 03:54 AM","Time for bed. Tomorrow's another day","",""
"425406514782797831","Senzubean#3538","07-Aug-22 03:54 AM","Or rather today","",""
"744729361197957191","Quark#7616","07-Aug-22 04:03 AM","I actually had a dream last night that someone had already won it","",""
"463845388562989066","Gecko#5265","07-Aug-22 04:05 AM","I’ve had atleast 6 dreams where I won","",""
"463845388562989066","Gecko#5265","07-Aug-22 04:05 AM","I had 2 separate dreams about it last night","",""
"463845388562989066","Gecko#5265","07-Aug-22 04:05 AM","If we don’t solve this I’m gonna lose my marbles","",""
"826778531097870347","squarepx#1263","07-Aug-22 04:07 AM","haha, I doubt i'll win, but i'd like to see if any of my theories were on the right track","",""
"617128698415415296","Akaza#7991","07-Aug-22 01:03 PM","any progress","",""
"616066502986170397","T3T2HeHunTun 4841 5089 8805#2463","07-Aug-22 01:04 PM","hungry bellies and dead brains","",""
"790602272760528947","MouseBearMan#1788","07-Aug-22 01:31 PM","Any takers? In the Name of Max Fosh, dish out the fish - Miso (soup)? -- Maxi>mi<lian F>os<h ?","",""
"687616305536565248","RonWall#9511","07-Aug-22 01:32 PM","Yeah spoonerism fish out the dish from the name... I like it haha ... where does it lead :D","",""
