AuthorID,Author,Date,Content,Attachments,Reactions
"972945633717657700","N3ktar1os#0263","04-Aug-22 07:47 PM","yo","",""
"679722117935399024","river#5860","04-Aug-22 07:47 PM","first","",""
"972945633717657700","N3ktar1os#0263","04-Aug-22 07:47 PM","nope","",""
"722475364215160842","Lily Sparkles#9745","04-Aug-22 07:47 PM","Hi","",""
"795347239391199232","Patrick Tate#2720","04-Aug-22 07:48 PM","Based","",""
"992131907607347341","kitkatΔΔΔ#2962","04-Aug-22 07:52 PM","i love your pfp!","","🤍 (1)"
"189864893397073921","Kademo#7046","04-Aug-22 07:55 PM","4:39
in the name of max fosh to shout the
4:41
fish that's all you need to spout
4:44
exactly who to ask and how just use my
4:46
vid to find out to claim the pressure's
4:48
trout
4:49
neighbor on the bus or a dear old queen
4:52
with the possibility the world is packed
4:54
but the keeper of the secret is not
4:56
close to max and that's beyond a fact
5:00
dance in a crazy way use squeaky voice
5:02
post on tick tock videos no need to spam
5:06
or guess or stir things up just copy
5:08
what the silly song shows
5:11
best of luck","",""
"264051145310208000","N278#6821","04-Aug-22 07:57 PM","it's all in #🕵clues","",""
"189864893397073921","Kademo#7046","04-Aug-22 07:57 PM","ah still i added the time stamps xD","",""
"264051145310208000","N278#6821","04-Aug-22 07:57 PM","^^","",""
"189864893397073921","Kademo#7046","04-Aug-22 08:00 PM","https://uk.linkedin.com/in/joanna-hardy-66398013","",""
"189864893397073921","Kademo#7046","04-Aug-22 08:03 PM","http://www.joannahardy.com/contact","",""
"189864893397073921","Kademo#7046","04-Aug-22 08:04 PM","https://www.instagram.com/p/CgwsDbiM4bH/","",""
"189864893397073921","Kademo#7046","04-Aug-22 08:05 PM","(will be singing a song on his channel and within the lyrics will be clues to where you will be able to find this goldfish which is buried somewhere in the UK)","",""
"189864893397073921","Kademo#7046","04-Aug-22 08:06 PM","https://www.tiktok.com/@maxfosh?","",""
"774911701426241556","Deede#6554","04-Aug-22 08:10 PM","the thing is she doesnt know bc he said she could participate as well implying that she knows as much as we do and it was said that everyone can find it","",""
"189864893397073921","Kademo#7046","04-Aug-22 08:13 PM","well she knew he was singing a song","","👍 (1)"
"189864893397073921","Kademo#7046","04-Aug-22 08:13 PM","and that post is 2 days old","",""
"189864893397073921","Kademo#7046","04-Aug-22 08:13 PM","sam hunter","",""
"774911701426241556","Deede#6554","04-Aug-22 08:18 PM","but that doesnt give here an advantage  but if she definitely knew it is buried it would give here a massive advantage and max said ""All you need to solve the treasure hunt is in this video. ""  in the desc","",""
"417367513303875594","Nextensi#2388","04-Aug-22 09:19 PM","https://youtube.com/clip/UgkxngLdBaQiUUqfeXFbMgkaIZ7_iOH2fvAK","",""
"272235825498947594","Gifting aka DaffinTheDuck#9058","04-Aug-22 09:33 PM","Im making a discord for clues etc. Dm if u want an invite. Ik there is a doc but its easier so people dont delete stuff.","",""
"213869999767552000","iAmCursed#2404","04-Aug-22 09:46 PM","description/history of masquerade 1979","https://cdn.discordapp.com/attachments/1004807688636612698/1004837730167029871/unknown.png",""
"213869999767552000","iAmCursed#2404","04-Aug-22 09:47 PM","solution for the hunt created by masquerade 1979","https://cdn.discordapp.com/attachments/1004807688636612698/1004837882017611866/unknown.png",""
"213869999767552000","iAmCursed#2404","04-Aug-22 09:53 PM","looks like a lot of elements of this hunt are pulled almost precisely to the author of masquerade","",""
"213869999767552000","iAmCursed#2404","04-Aug-22 09:54 PM","what I mean is ""To ensure that readers from further afield had an equal chance of winning, Williams also announced that he would accept the first precisely correct answer sent to him by post."" **Anyone outside of the UK can claim the fish**","",""
"213869999767552000","iAmCursed#2404","04-Aug-22 09:54 PM","""The casket was inscribed with the legend ""I am the keeper of the jewel of Masquerade, which lies waiting safe inside me for you or eternity"" **Keeper of the treasure, in this case the person we need to ask for the fish**","",""
"213869999767552000","iAmCursed#2404","04-Aug-22 09:55 PM","""Williams announced publicly that his forthcoming book contained all clues necessary to identify the treasure's precise location in Britain to ""within a few inches."" At the time, the only additional clue he provided was that the hare was buried on public property that could be easily accessed."" **He has stated in the description that all information needed is in the video itself**","",""
"213869999767552000","iAmCursed#2404","04-Aug-22 09:57 PM",".
Lots of direct inspiration so maybe looking further into Masquerade 1979 could forge a better path to the solution.","",""
"829453509346066432","DRWHOCOBY#6061","04-Aug-22 09:59 PM","I was thinking we could do the same thing as that puzzle, drawing lines from either Max's eyes through their hands to the captions or from the fish's eyes through their fins.","",""
"331357689198411778","endorfin#3221","04-Aug-22 10:00 PM","nah too obvious i think","",""
"331357689198411778","endorfin#3221","04-Aug-22 10:01 PM","also is very hard to do conspicuously with live video","",""
"331357689198411778","endorfin#3221","04-Aug-22 10:01 PM","compared to art in masquerade","",""
"728638341574033509","The superstar#2670","04-Aug-22 10:20 PM","But then he also says something to do with trout so is there somone lincked to trout also could they be someone he doesnt know that well as he says the keeper of the secret aint someone he knows","",""
"678719312483188736","MatthewXia#7596","04-Aug-22 10:26 PM","He caught a trout in one of his videos","",""
"843568402434097183","eddie_keeno#6861","04-Aug-22 10:27 PM","‘In the name of max fosh’ points surely towards something in his name. An anagram, his middle name something like that?","",""
"342375302619594762","Volarus#5594","04-Aug-22 10:30 PM","yeah arthur","",""
"592094921519792316","EmmaS#0894","04-Aug-22 10:30 PM","dear old queen is a common spoonerism which translates to queer old dean. William Spooner who it was named after was a dean at new college oxford","",""
"342375302619594762","Volarus#5594","04-Aug-22 10:31 PM","though I do think that phrase it legit what you are meant to say to someone","",""
"843568402434097183","eddie_keeno#6861","04-Aug-22 10:45 PM","Anyone had anything on neighbour on the bus?","",""
"843568402434097183","eddie_keeno#6861","04-Aug-22 10:45 PM","Comes right before the spoonerism","",""
"263703743411912707","volt64bolt#2496","04-Aug-22 10:46 PM","Nope, I asked the old lady at the back and she got off at the next stop after giving me a weird look","","😆 (3),😂 (1)"
"930113532756910170","Zonezz19#1133","04-Aug-22 10:47 PM","You can get hoax from his name","","👍 (1)"
"843568402434097183","eddie_keeno#6861","04-Aug-22 11:06 PM","Having read this- it feels like a really solid lead. Would be very like fosh to use a former nationwide treasure hunt to tie into his own. Maybe we find some of the methods used in it and try and apply them here?","",""
"263703743411912707","volt64bolt#2496","04-Aug-22 11:06 PM","Time to re read the book...","",""
"213869999767552000","iAmCursed#2404","04-Aug-22 11:07 PM","Well its literally referenced in one of the posts","",""
"213869999767552000","iAmCursed#2404","04-Aug-22 11:07 PM","about the goldfosh","",""
"213869999767552000","iAmCursed#2404","04-Aug-22 11:08 PM","I'm just thinking, if so many aspects are that similar to the original, why wouldn't more?","","👍 (2)"
"347160194259877930","Canadian Cheese#5573","04-Aug-22 11:08 PM","might be onto something here tbh","",""
"213869999767552000","iAmCursed#2404","04-Aug-22 11:11 PM","He made specific reference that you don't need to be in the UK and his stance on not being involved any further, confirmed by Tom/Eve that he put all the info in the video already. Ties VERY closely to the original hunt","",""
"278008482819473409","CupofJoe#0324","04-Aug-22 11:11 PM","Now we just need to somehow translate the song in the same way as this","",""
"263703743411912707","volt64bolt#2496","04-Aug-22 11:12 PM","Does anyone have the musical notation? I found this from someone somewhere but I’m not sure if it’s correct","https://cdn.discordapp.com/attachments/1004807688636612698/1004859482565787678/IMG_0453.jpg",""
"843568402434097183","eddie_keeno#6861","04-Aug-22 11:13 PM","The original hunt had a lot visual clues that lead to anagrams and ultimately a message- the first letters of each spelled a clue","",""
"415233547138236416","Kilroy#0548","04-Aug-22 11:14 PM","You can’t expect him to take the same method of hiding the treasure though","",""
"415233547138236416","Kilroy#0548","04-Aug-22 11:14 PM","Or even a remotely similar method","",""
"213869999767552000","iAmCursed#2404","04-Aug-22 11:15 PM","Why not?","",""
"843568402434097183","eddie_keeno#6861","04-Aug-22 11:15 PM","Maybe not exactly but it could definitely have some relation to a next step","",""
"213869999767552000","iAmCursed#2404","04-Aug-22 11:15 PM","besides its obviously not the same method","",""
"213869999767552000","iAmCursed#2404","04-Aug-22 11:16 PM","My main direction with my posts are that, after listening to this general chat for hours, there are so many CRAZY leads that people are taking. When in his video he says all you need is the clues in the video, I think it is not as complex as people are making it out to be.","",""
"213869999767552000","iAmCursed#2404","04-Aug-22 11:16 PM","Which we can use the direct inspiration to better troubleshoot","",""
"213869999767552000","iAmCursed#2404","04-Aug-22 11:18 PM","for example, they currently are on a red herring about being at a bridge in the UK somewhere for the answer.

That makes nearly no sense with his statement about anyone can claim it, even outside the UK","",""
"843568402434097183","eddie_keeno#6861","04-Aug-22 11:18 PM","Seems a coincidence that the additional hint published in the Sunday times for the original hunt pictured a man holding a fish","https://cdn.discordapp.com/attachments/1004807688636612698/1004860902274781204/IMG_0004.gif",""
"347160194259877930","Canadian Cheese#5573","04-Aug-22 11:18 PM","i 100% agree with you","",""
"369117603123429377","Lizzie#0835","04-Aug-22 11:19 PM","especially with the fish having a number on it, was that used in the original hunt?","",""
"922531793226313769","NoelHuibers#5507","04-Aug-22 11:19 PM","yeah i thought from the perspective of josh this hunt is perfect for a follow up video explaining the hunt and then giving the fish to the winner","",""
"389111703725539328","stealth.py#5525","04-Aug-22 11:19 PM","reminds me of the liber primus channels from the cicada server","",""
"389111703725539328","stealth.py#5525","04-Aug-22 11:19 PM","💀","",""
"922531793226313769","NoelHuibers#5507","04-Aug-22 11:19 PM","which made me think we probably search something online an url a number a social media name (But if so what?)","",""
"922531793226313769","NoelHuibers#5507","04-Aug-22 11:19 PM","good old times","",""
"843568402434097183","eddie_keeno#6861","04-Aug-22 11:20 PM","It was a an additional clue published as people were stuck. Not 100% sure the number played a significant role though","",""
"213869999767552000","iAmCursed#2404","04-Aug-22 11:20 PM","Personally I think theres SOMETHING at the end of the ad segment at 4:30","",""
"213869999767552000","iAmCursed#2404","04-Aug-22 11:21 PM","Looks way too unnatural","",""
"922531793226313769","NoelHuibers#5507","04-Aug-22 11:21 PM","but i think someone would brute force spambot accounts at this point if it would be cicada 😄","",""
"213869999767552000","iAmCursed#2404","04-Aug-22 11:21 PM","between the way his left hand is and the mouthing words at the fade away","",""
"347160194259877930","Canadian Cheese#5573","04-Aug-22 11:21 PM","i dont think so","",""
"347160194259877930","Canadian Cheese#5573","04-Aug-22 11:21 PM","people were already barking up that tree for like an hour","",""
"389111703725539328","stealth.py#5525","04-Aug-22 11:21 PM","hahahahhahaahh that does sound true XD","",""
"213869999767552000","iAmCursed#2404","04-Aug-22 11:21 PM","I haven't heard anyone talk about it besides asking if anyone can read lips","",""
"347160194259877930","Canadian Cheese#5573","04-Aug-22 11:22 PM","i saw someone trying to figure out some pattern of the way the fish was spinning in different parts of the video","",""
"398107630524039170","hekerman#7015","04-Aug-22 11:22 PM","https://duckduckgo.com/?t=ffab&q=blue+agate&iax=images&ia=images
the stone used as the baseplate","",""
"286892445197926410","Wex#1610","04-Aug-22 11:22 PM","I have a theory about what he said, but it's probably the wrong tree","",""
"922531793226313769","NoelHuibers#5507","04-Aug-22 11:23 PM","but reverse engineering the hunt might be smart i mean when did he film the video. so in which timeframe did it get created.","",""
"389111703725539328","stealth.py#5525","04-Aug-22 11:23 PM","is it cold in the uk right about now?","",""
"843568402434097183","eddie_keeno#6861","04-Aug-22 11:24 PM","Hardly relevant I’m sure but kit Williams the guy who made masquerade in 2019 made a sculpture in Cheltenham of a fish and a clock. It’s still there to be viewed.","https://cdn.discordapp.com/attachments/1004807688636612698/1004862294204883125/F3983BC9-E8E3-42BE-811A-ED8097DFBC51.jpg",""
"389111703725539328","stealth.py#5525","04-Aug-22 11:24 PM","i mean, not the uk
but the general area around which the video was filmed","",""
"389111703725539328","stealth.py#5525","04-Aug-22 11:24 PM","that might give us an idea of the timeframe","",""
"843568402434097183","eddie_keeno#6861","04-Aug-22 11:24 PM","Although that surely has nothing to do with this","",""
"263703743411912707","volt64bolt#2496","04-Aug-22 11:24 PM","But what fish is it","",""
"389111703725539328","stealth.py#5525","04-Aug-22 11:24 PM","ok nvm it seems like its summer anyways 🗿","",""
"922531793226313769","NoelHuibers#5507","04-Aug-22 11:25 PM","so Chris send me this about the sponsor of the video","",""
"922531793226313769","NoelHuibers#5507","04-Aug-22 11:25 PM","Reg. Code    16235024
Company status    Entered into the register
Year established    2021 / 1 year and 2 months","",""
"922531793226313769","NoelHuibers#5507","04-Aug-22 11:25 PM","so its hard to believe the hunt is planed older then that","",""
"389111703725539328","stealth.py#5525","04-Aug-22 11:25 PM","yeah it shouldve been planned out for quite a while i think","",""
"922531793226313769","NoelHuibers#5507","04-Aug-22 11:27 PM","and he said the fish did take 3 months in creation","",""
"389111703725539328","stealth.py#5525","04-Aug-22 11:28 PM","again, https://opencorporates.com/companies/gb/12069656","",""
"389111703725539328","stealth.py#5525","04-Aug-22 11:28 PM","i think this got overlooked or people mightve looked at it already but","",""
"263703743411912707","volt64bolt#2496","04-Aug-22 11:28 PM","Already looked at","",""
"263703743411912707","volt64bolt#2496","04-Aug-22 11:28 PM","Mostly nothing","",""
"389111703725539328","stealth.py#5525","04-Aug-22 11:29 PM","yeah","",""
"928754592517353472","lloydc#0590","04-Aug-22 11:29 PM","https://www.tiktok.com/@goldfoshclues?is_from_webapp=1&sender_device=pc","",""
"420700467971227658","pelagamer02#1952","04-Aug-22 11:30 PM","https://en.wikipedia.org/wiki/It%27s_a_Long_Way_to_Tipperary","",""
"420700467971227658","pelagamer02#1952","04-Aug-22 11:30 PM","look into this","",""
"420700467971227658","pelagamer02#1952","04-Aug-22 11:30 PM","the other claim section","",""
"398107630524039170","hekerman#7015","04-Aug-22 11:31 PM","","https://cdn.discordapp.com/attachments/1004807688636612698/1004864118043447397/unknown.png",""
"398107630524039170","hekerman#7015","04-Aug-22 11:31 PM","da heck is this","",""
"398107630524039170","hekerman#7015","04-Aug-22 11:31 PM","kike?","",""
"189864893397073921","Kademo#7046","04-Aug-22 11:32 PM","@GEbb4 so what u sent was just a troll?","",""
"263703743411912707","volt64bolt#2496","04-Aug-22 11:32 PM","Yes","",""
"263703743411912707","volt64bolt#2496","04-Aug-22 11:32 PM","It was Winnie the Pooh","",""
"469970820404609041","GEbb4#0001","04-Aug-22 11:32 PM","Just a bit of entertainment to keep you all busy","","💀 (1)"
"469970820404609041","GEbb4#0001","04-Aug-22 11:33 PM","Nothing to do with the hunt","",""
"189864893397073921","Kademo#7046","04-Aug-22 11:33 PM","wow such a funny one","",""
"469970820404609041","GEbb4#0001","04-Aug-22 11:33 PM","Just a bonus clue to solve as practice for the real thing","",""
"469970820404609041","GEbb4#0001","04-Aug-22 11:33 PM","You're welcome x","",""
"263703743411912707","volt64bolt#2496","04-Aug-22 11:33 PM","WINNIE THE POOH IS THE ANSWER TOO ALL","",""
"263703743411912707","volt64bolt#2496","04-Aug-22 11:33 PM","HE WILL HELP US FIND THE FISH","",""
"469970820404609041","GEbb4#0001","04-Aug-22 11:33 PM","Winnie the Pooh spells it ""Hunny""","",""
"263703743411912707","volt64bolt#2496","04-Aug-22 11:33 PM","He’s a bear he can’t spell","",""
"263703743411912707","volt64bolt#2496","04-Aug-22 11:34 PM","Your just trying to push me away from the answer","",""
"263703743411912707","volt64bolt#2496","04-Aug-22 11:34 PM","I’m on to you...","",""
"469970820404609041","GEbb4#0001","04-Aug-22 11:34 PM","👀","",""
"263703743411912707","volt64bolt#2496","04-Aug-22 11:34 PM","👀","",""
"796127154898206747","Dog#5383","04-Aug-22 11:34 PM","can someone send me the fosh cermics link por favor","",""
"712383869516775505","tenrec#8833","04-Aug-22 11:34 PM","mhm","","✅ (2)"
"712383869516775505","tenrec#8833","04-Aug-22 11:35 PM","I have a hunch about a song but it's prob wrong","",""
"709827976929345567","Golden Wither#7748","04-Aug-22 11:41 PM","heres a collection of a bunch of clues:
https://mrdkoz.notion.site/Max-Fosh-Goldfosh-Hunt-1f6b89eeee664bdc92e5a3d174dc5ab8","",""
"784825209407799297","RoGarf#7848","04-Aug-22 11:45 PM","This is really nicely made, thanks for making it!","",""
"148531728472866827","LazarkGaming#8026","04-Aug-22 11:45 PM","fish with an 0 limited is just his company for youtube, it's pretty easy if you read the files/accounts.","",""
"709827976929345567","Golden Wither#7748","04-Aug-22 11:45 PM","i didnt make it, it was made by @ MrDKOz","",""
"784825209407799297","RoGarf#7848","04-Aug-22 11:45 PM","Ah, ok","",""
"148531728472866827","LazarkGaming#8026","04-Aug-22 11:46 PM","gardiner fosh are accountants, most companies' address are just their accountants address","",""
"148531728472866827","LazarkGaming#8026","04-Aug-22 11:54 PM","they only thing we learn about his personal info, is that youtube money isn't as good as it used to be.","",""
"398107630524039170","hekerman#7015","04-Aug-22 11:57 PM","the entire video","https://cdn.discordapp.com/attachments/1004807688636612698/1004870840531296386/unknown.png",""
"398107630524039170","hekerman#7015","04-Aug-22 11:58 PM","the last clue part","https://cdn.discordapp.com/attachments/1004807688636612698/1004870916821499905/unknown.png",""
"357607292750921730","EBhero#8034","04-Aug-22 11:58 PM","Youtube compression would probably ruin any secrets in teh spectogram","",""
"398107630524039170","hekerman#7015","04-Aug-22 11:59 PM","i guess, but if they are obvious enough they would be visible","",""
"203758781388029962","dmf444#6939","05-Aug-22 12:00 AM","Don't think that's true... several ARG use spectrograms from YT","",""
"398107630524039170","hekerman#7015","05-Aug-22 12:00 AM","ARG ?","",""
"203758781388029962","dmf444#6939","05-Aug-22 12:00 AM","Augmented Reality Games just a type of digital treasure hunt","",""
"398107630524039170","hekerman#7015","05-Aug-22 12:01 AM","ah","",""
"947228816290496583","BigMama#7159","05-Aug-22 12:01 AM","Backrooms innit","",""
"947228816290496583","BigMama#7159","05-Aug-22 12:01 AM","Nah","",""
"947228816290496583","BigMama#7159","05-Aug-22 12:01 AM","I'm losing brain cells","",""
"709827976929345567","Golden Wither#7748","05-Aug-22 12:02 AM","the spectrogram theory was discussed a while ago... heres the start if you want to see:
https://discord.com/channels/843521269085241384/1004807711709470821/1004825644187795476","",""
"709827976929345567","Golden Wither#7748","05-Aug-22 12:02 AM","im not sure there was ever really a conclusion, but they found something that looks like a waveform in the audio","",""
"203758781388029962","dmf444#6939","05-Aug-22 12:02 AM","Yep, I'm still looking into it","","👍 (1)"
"398107630524039170","hekerman#7015","05-Aug-22 12:03 AM","yeah this","https://cdn.discordapp.com/attachments/1004807688636612698/1004872121396244500/unknown.png",""
"505852170076422164","Archi3#4770","05-Aug-22 12:05 AM","Anyone notice at 2:06in the video the man behind max just dissappears","",""
"947228816290496583","BigMama#7159","05-Aug-22 12:08 AM","Its just a cut in the vid","",""
"286892445197926410","Wex#1610","05-Aug-22 12:23 AM","So I matched up the times on those and these all line up specifically with when he's using what appears to be his phone for recording","",""
"398107630524039170","hekerman#7015","05-Aug-22 12:24 AM","okay","",""
"398107630524039170","hekerman#7015","05-Aug-22 12:24 AM","so its basically just the audio difference between camera and phone","","❤️ (1)"
"286892445197926410","Wex#1610","05-Aug-22 12:25 AM","That's what it seems like to me, I tried to read anything in those tea leaves, but I think it's a dead end","",""
"910048297404727357","FrancescBoCo#7794","05-Aug-22 12:56 AM","Jason donovan","",""
"165658906100498434","meliwazhere#6126","05-Aug-22 06:53 AM","Is Max doing a play on words again? ""But the keeper of the secret is not close to Max"" so the keep is the Min?","",""
"987736516161847346","Curse#3794","05-Aug-22 06:54 AM","Minimum","",""
"987736516161847346","Curse#3794","05-Aug-22 06:54 AM","its his mum","",""
"987736516161847346","Curse#3794","05-Aug-22 06:54 AM","confirmed","",""
"165658906100498434","meliwazhere#6126","05-Aug-22 06:55 AM","I thought it could be related to Minions","",""
"165658906100498434","meliwazhere#6126","05-Aug-22 06:55 AM","""Dance in a crazy way, use a squeaky voice"" matches them","",""
"165658906100498434","meliwazhere#6126","05-Aug-22 06:55 AM","They had a movie about a queen. But nothing about the bus so kinda a dead end there","",""
"679362472020279317","Hii#4258","05-Aug-22 07:06 AM","Oh yehhh yeah minions","",""
"850906056472133672","tickle my fiddle#8104","05-Aug-22 07:08 AM","yeah guys its the minions\","",""
"313093370446872597","inactivelyon#8086","05-Aug-22 07:09 AM","This makes so much sense","",""
"217572426911973376","Touhou simp#9126","05-Aug-22 07:09 AM","we need to find a minion and ask for fish","",""
"313093370446872597","inactivelyon#8086","05-Aug-22 07:09 AM","Yes","",""
"313093370446872597","inactivelyon#8086","05-Aug-22 07:09 AM","Find gru","",""
"165658906100498434","meliwazhere#6126","05-Aug-22 07:10 AM","someone @ universal pictures lol","",""
"313093370446872597","inactivelyon#8086","05-Aug-22 07:10 AM","For real","",""
"165658906100498434","meliwazhere#6126","05-Aug-22 07:15 AM","fishing minion -> minecraft https://hypixel-skyblock.fandom.com/wiki/Fishing_Minion","",""
"165658906100498434","meliwazhere#6126","05-Aug-22 07:15 AM","Theres a #minecraft-general channel here.","",""
"165658906100498434","meliwazhere#6126","05-Aug-22 07:16 AM","(Another idea I had was my NEIGHBOR Totoro and the cat BUS but there's no queen so idk)","",""
"889491615234818079","masyali#0158","05-Aug-22 07:18 AM","KUUDRA MANDABLE","",""
"889491615234818079","masyali#0158","05-Aug-22 07:18 AM","IT ALL LEADS BACK TO DRAGOON","",""
"850906056472133672","tickle my fiddle#8104","05-Aug-22 07:30 AM","hypixel skyblock?","",""
"850906056472133672","tickle my fiddle#8104","05-Aug-22 07:30 AM","does this mean? thirtyvirus has the fish????","",""
"850906056472133672","tickle my fiddle#8104","05-Aug-22 07:31 AM","or even simon??/?","",""
"850906056472133672","tickle my fiddle#8104","05-Aug-22 07:31 AM","jk","",""
"850906056472133672","tickle my fiddle#8104","05-Aug-22 07:31 AM","DRAGOONS HAS FISH","",""
"889491615234818079","masyali#0158","05-Aug-22 07:32 AM","I was so right","",""
"889491615234818079","masyali#0158","05-Aug-22 07:32 AM","We need to find the kuudra","",""
"889491615234818079","masyali#0158","05-Aug-22 07:32 AM","And we will get it","",""
"850906056472133672","tickle my fiddle#8104","05-Aug-22 07:33 AM","kudra has a hint for us","",""
"889491615234818079","masyali#0158","05-Aug-22 07:33 AM","Yep","",""
"850906056472133672","tickle my fiddle#8104","05-Aug-22 07:34 AM","now how do we find the jaw of the kudra","",""
"850906056472133672","tickle my fiddle#8104","05-Aug-22 07:34 AM","i havent played hypixel skyblock in like a year","",""
"272235825498947594","Gifting aka DaffinTheDuck#9058","05-Aug-22 08:32 AM","Dm me if u want a lot of clues im collecting with people we have about 120+ people so far","",""
"900282221351538748","kets#8989","05-Aug-22 08:56 AM","Wait im sure there were buses I used to watch that movie years ago","",""
"712383869516775505","tenrec#8833","05-Aug-22 09:33 AM","Sure","",""
"272235825498947594","Gifting aka DaffinTheDuck#9058","05-Aug-22 09:41 AM","**IF ANYONE HAS ANY NEW SERVERS OF CLUES OR DOCUMENTS PLEASE SEND ME THEM IN DMS.**","",""
"263703743411912707","volt64bolt#2496","05-Aug-22 10:01 AM","Stop the spam dude","",""
"272235825498947594","Gifting aka DaffinTheDuck#9058","05-Aug-22 10:02 AM","not spam","",""
"272235825498947594","Gifting aka DaffinTheDuck#9058","05-Aug-22 10:02 AM","this is over a hour old","",""
