AuthorID,Author,Date,Content,Attachments,Reactions
"263703743411912707","volt64bolt#2496","05-Aug-22 12:31 PM","haha","",""
"449277066727129098","Emil10 045#2940","05-Aug-22 12:31 PM","i dont even have tiktok","",""
"576660916519567370","Liljoe18#1913","05-Aug-22 12:31 PM","What if every old lady has the fish","",""
"318649930371563520","Hyperterdle6#7817","05-Aug-22 12:31 PM","It says post on tiktok videos
Not post a tiktok video","",""
"449277066727129098","Emil10 045#2940","05-Aug-22 12:31 PM","true","",""
"263703743411912707","volt64bolt#2496","05-Aug-22 12:31 PM","WE NEED TO MAKE A TIK TOCK OF US POSTING A FISH TO MAX","",""
"394874082618769409","ollie#3373","05-Aug-22 12:32 PM","guys","",""
"745212367284994062","Im walking here.#1006","05-Aug-22 12:32 PM","Yes","",""
"263703743411912707","volt64bolt#2496","05-Aug-22 12:32 PM","wat","",""
"263703743411912707","volt64bolt#2496","05-Aug-22 12:32 PM","which website","",""
"394874082618769409","ollie#3373","05-Aug-22 12:32 PM","pianoz.com","",""
"394874082618769409","ollie#3373","05-Aug-22 12:32 PM","looks like nothing tho","",""
"394874082618769409","ollie#3373","05-Aug-22 12:32 PM","nvm","",""
"745212367284994062","Im walking here.#1006","05-Aug-22 12:32 PM","Just one more thing Sedona Arizona is famous for their fish","",""
"762017073571823637","Supported4#4268","05-Aug-22 12:32 PM","where did it say that?","",""
"394874082618769409","ollie#3373","05-Aug-22 12:32 PM","just that ive tried a bunch of other images and it errored, this one got some data but looks useless","",""
"263703743411912707","volt64bolt#2496","05-Aug-22 12:32 PM","","https://cdn.discordapp.com/attachments/1004807688636612698/1005060797032054857/unknown.png",""
"762017073571823637","Supported4#4268","05-Aug-22 12:32 PM","huh","",""
"263703743411912707","volt64bolt#2496","05-Aug-22 12:33 PM","i dont think the pianoz website truly is the answer","",""
"394874082618769409","ollie#3373","05-Aug-22 12:33 PM","i think theres possibly some involvement","",""
"762017073571823637","Supported4#4268","05-Aug-22 12:33 PM","i mean it's worth investigating","",""
"263703743411912707","volt64bolt#2496","05-Aug-22 12:33 PM","guys, what if we need to change our name to max fosh, and then go around and give people fish?","",""
"745212367284994062","Im walking here.#1006","05-Aug-22 12:34 PM","Um Sedona has also gone under some restoration projects","",""
"394874082618769409","ollie#3373","05-Aug-22 12:37 PM","this is interesting, going back to what i tried with outguess - i managed to get 2 files out of images on the pianoz website, every other one errored - used the key ""512"" derived from video length
trying other keys on the same 2 images gives errors
may be a weird coincidence or they may actually hold some information, just trying to figure out what we'd be reconstructing with this data","",""
"263703743411912707","volt64bolt#2496","05-Aug-22 12:38 PM","hmm","",""
"394874082618769409","ollie#3373","05-Aug-22 12:38 PM","the two images that successfully provided data also are named slightly differently to all the others, probably meaningless but still noteworthy","https://cdn.discordapp.com/attachments/1004807688636612698/1005062214358663248/unknown.png,https://cdn.discordapp.com/attachments/1004807688636612698/1005062214660665465/unknown.png",""
"263703743411912707","volt64bolt#2496","05-Aug-22 12:38 PM","is that these images?","https://cdn.discordapp.com/attachments/1004807688636612698/1005062355585085450/unknown.png",""
"394874082618769409","ollie#3373","05-Aug-22 12:39 PM","its two of those yes","",""
"263703743411912707","volt64bolt#2496","05-Aug-22 12:39 PM","ah kk","",""
"394874082618769409","ollie#3373","05-Aug-22 12:39 PM","","https://cdn.discordapp.com/attachments/1004807688636612698/1005062426447847434/IMG_1979_0.jpg,https://cdn.discordapp.com/attachments/1004807688636612698/1005062426703695974/IMG_1980_0.jpg",""
"576660916519567370","Liljoe18#1913","05-Aug-22 12:39 PM","Is there any merit to the Jason Donnavan lead?","",""
"263703743411912707","volt64bolt#2496","05-Aug-22 12:39 PM","not really","",""
"263703743411912707","volt64bolt#2496","05-Aug-22 12:39 PM","http://practicalcryptography.com/ciphers/ i tried all these ciphers aswell to no avail","",""
"394874082618769409","ollie#3373","05-Aug-22 12:39 PM","the data from outguess","https://cdn.discordapp.com/attachments/1004807688636612698/1005062587823693864/IMG_1980_0_Outguess,https://cdn.discordapp.com/attachments/1004807688636612698/1005062588100526211/IMG_1979_0_Outguess",""
"263703743411912707","volt64bolt#2496","05-Aug-22 12:40 PM","what format is it?","",""
"576660916519567370","Liljoe18#1913","05-Aug-22 12:40 PM","I think ""anyone"" refers to the fact that someone can solve it from anywhere, not that everyone would be able to?","",""
"394874082618769409","ollie#3373","05-Aug-22 12:40 PM","i dont know","",""
"576660916519567370","Liljoe18#1913","05-Aug-22 12:40 PM","if that makes sense?","",""
"263703743411912707","volt64bolt#2496","05-Aug-22 12:40 PM","that makes sesne ye","",""
"394874082618769409","ollie#3373","05-Aug-22 12:42 PM","somebody with a bit more intelligence than me should take a look at this imo, its very odd that only two images would return any information, **especially** when its only the key 512 getting that information out","",""
"263703743411912707","volt64bolt#2496","05-Aug-22 12:43 PM","i tried but it wont let me open them so i cant","",""
"394874082618769409","ollie#3373","05-Aug-22 12:43 PM","they just look like this right now","https://cdn.discordapp.com/attachments/1004807688636612698/1005063610336301066/unknown.png",""
"263703743411912707","volt64bolt#2496","05-Aug-22 12:44 PM","ah","",""
"263703743411912707","volt64bolt#2496","05-Aug-22 12:44 PM","then thats most likely nothing","",""
"263703743411912707","volt64bolt#2496","05-Aug-22 12:44 PM","it would be cleaner","",""
"394874082618769409","ollie#3373","05-Aug-22 12:44 PM","i dont think so","",""
"394874082618769409","ollie#3373","05-Aug-22 12:44 PM","it looks like its something that needs to be in a particular format","",""
"263703743411912707","volt64bolt#2496","05-Aug-22 12:45 PM","hmm","",""
"263703743411912707","volt64bolt#2496","05-Aug-22 12:45 PM","true","",""
"263703743411912707","volt64bolt#2496","05-Aug-22 12:45 PM","very well, i shall try stuff like that","",""
"394874082618769409","ollie#3373","05-Aug-22 12:45 PM","@volt64bolt this is what a random jpg from my drive looks like when opened in text","https://cdn.discordapp.com/attachments/1004807688636612698/1005063915639676998/unknown.png",""
"576660916519567370","Liljoe18#1913","05-Aug-22 12:45 PM","I swear if we keep goign down the organge website were just going to end up doxxing whoever made it","","💀 (2)"
"394874082618769409","ollie#3373","05-Aug-22 12:45 PM","ive tried jpg extension and it wont open tho","",""
"576660916519567370","Liljoe18#1913","05-Aug-22 12:45 PM","lmao","",""
"394874082618769409","ollie#3373","05-Aug-22 12:45 PM","it might be that we have to cross the two files together in some way or something","",""
"263703743411912707","volt64bolt#2496","05-Aug-22 12:45 PM","this is reminding me of when i took part in an anti cyber crrime competition many years ago","",""
"263703743411912707","volt64bolt#2496","05-Aug-22 12:45 PM","gtg now, will look at the images later","",""
"617014907518451713","Rufus#5754","05-Aug-22 01:52 PM","Followed by max goldfish???","",""
"617014907518451713","Rufus#5754","05-Aug-22 01:53 PM","pretty sure it's a coincedence","",""
"689511154103746610","PatrickWilkinson#1321","05-Aug-22 03:41 PM","old queen is queen victoria","",""
"795347239391199232","Patrick Tate#2720","05-Aug-22 03:46 PM","Where’s she buried…","",""
"827371943749484544","Sn0leopard#2617","05-Aug-22 03:46 PM","no digging up dead queens","","😂 (3)"
"935495861952208926","soul23#4552","05-Aug-22 04:05 PM","Ok,this is my theory if we look at the capital letters of the second paragraph we see the letter NW BA if we look at the British zip code NW is London meanwhile BA is the city of Bath .There you can find the royal victoria park where queen victoria sent when she was 11 years old","",""
"762017073571823637","Supported4#4268","05-Aug-22 04:10 PM","wtf?","",""
"827371943749484544","Sn0leopard#2617","05-Aug-22 04:16 PM","""Chappell"" is written on the piano. There's a post from alcechppll07 on tiktok of a bridge in italy (<https://www.tiktok.com/@alcechppll07/video/7108344624422456582?is_copy_url=1&is_from_webapp=v1>). Joe Jenkins (piano player in the video) also played beneath this bridge in a tiktok. (<https://www.tiktok.com/@joejenkinsmusic/video/7034209620470140165>, <https://www.instagram.com/tv/CZZQ7j9uU_s/?igshid=YmMyMTA2M2Y=>). The bridge is called Rialto Bridge. (<https://www.google.com/maps/place/Rialto+Bridge/@45.4379611,12.3351015,133m/data=!3m1!1e3!4m12!1m6!3m5!1s0x477eb174f17b0d5f:0x4c66749b5eb190bb!2sRiva+Rialto!8m2!3d45.438012!4d12.3353948!3m4!1s0x477eb1c7faa33a3b:0x732011a1298ecc89!8m2!3d45.4379842!4d12.335898>). This could be relevant to Joe Jenkin's DM ""The fish swims under the bridge while i tickle the ivory, but why hasnt it been found? Perhaps the search should be deployed, wider""","",""
"827371943749484544","Sn0leopard#2617","05-Aug-22 04:17 PM","currently thinking about ""wider""","",""
"566723219088736287","BlairTempest#8218","05-Aug-22 04:20 PM","Why","",""
"566723219088736287","BlairTempest#8218","05-Aug-22 04:20 PM","Joe has been disproven","",""
"827371943749484544","Sn0leopard#2617","05-Aug-22 04:21 PM","where","",""
"566723219088736287","BlairTempest#8218","05-Aug-22 04:21 PM","One sec let me get it","",""
"827371943749484544","Sn0leopard#2617","05-Aug-22 04:21 PM","i havent seen'h","",""
"566723219088736287","BlairTempest#8218","05-Aug-22 04:21 PM","","https://cdn.discordapp.com/attachments/1004807688636612698/1005118384201015296/unknown.png",""
"256132654594916352","Waigen#8975","05-Aug-22 04:26 PM","Is this true or a red herring? Damn I'm thinking too much","",""
"827371943749484544","Sn0leopard#2617","05-Aug-22 04:28 PM","im just wondering if joe was fake then why is there a tiktok account that only posted a video of the same bridge he went under and another tiktok account that only commented on that video both similar to chappell","",""
"740613373066215485","Harrison#5786","05-Aug-22 04:30 PM","What’s the account called?","",""
"827371943749484544","Sn0leopard#2617","05-Aug-22 04:31 PM","https://www.tiktok.com/@alcechppll07","",""
"827371943749484544","Sn0leopard#2617","05-Aug-22 04:32 PM","https://www.tiktok.com/@spncrchppll","",""
"95147651565101056","zabraih#3296","05-Aug-22 04:33 PM","have you heard of family?","",""
"740613373066215485","Harrison#5786","05-Aug-22 04:33 PM","From what I can see it just looks like a family surname","",""
"740613373066215485","Harrison#5786","05-Aug-22 04:33 PM","Probably best not to harass them","",""
"827371943749484544","Sn0leopard#2617","05-Aug-22 04:33 PM","if you say so","",""
"740613373066215485","Harrison#5786","05-Aug-22 04:34 PM","(Although it is a mad coincidence)","",""
"447679508435173377","jozee001 l#8559","05-Aug-22 04:37 PM","So max has a company registered to him called Fish with an O limited at 31 St. Johns, Worcester, England, WR2 5AG opposite this is a church. Can anybody else make anything from it?","",""
"827371943749484544","Sn0leopard#2617","05-Aug-22 04:40 PM","too much my brain is dead bye","",""
"195553303613014016","Wille#8716","05-Aug-22 04:44 PM","why do we keep on doxxing him, I doubt that's helpful","",""
"212020468008484864","Bd09live#1901","05-Aug-22 04:56 PM","so i dont think im pursuing that path anymore (maybe for the song ill attempt it) but i did the masquerade thing with drawing lines just in the opening part (up till black screen after treasure hunt) and got S L I E Y M S A","",""
"263703743411912707","volt64bolt#2496","05-Aug-22 04:58 PM","no results from a shift cipher","https://cdn.discordapp.com/attachments/1004807688636612698/1005127768050253956/unknown.png",""
"212020468008484864","Bd09live#1901","05-Aug-22 04:59 PM","did a wordunscrambler and got aimless...just like how i feel right now","",""
"387552714017603585","Omichromium#8008","05-Aug-22 05:00 PM","Also aimless doesnt have the Y","",""
"212020468008484864","Bd09live#1901","05-Aug-22 05:00 PM","yeah that to","",""
"212020468008484864","Bd09live#1901","05-Aug-22 05:00 PM","going to go back and check to see if i hit what i thought i hit...but god watching at .25 speed sucks","",""
"212020468008484864","Bd09live#1901","05-Aug-22 05:02 PM","question: should i count the gold fosh as a character XD","",""
"263703743411912707","volt64bolt#2496","05-Aug-22 05:02 PM","yes","",""
"212020468008484864","Bd09live#1901","05-Aug-22 05:03 PM","https://tenor.com/view/ok-crying-sad-emotional-sentimental-gif-20646670","",""
"212020468008484864","Bd09live#1901","05-Aug-22 05:05 PM","@volt64bolt you just caused me pain","",""
"263703743411912707","volt64bolt#2496","05-Aug-22 05:05 PM","haha","",""
"212020468008484864","Bd09live#1901","05-Aug-22 05:05 PM","now i have to look at subtitles where i can only see the dang fish","",""
"212020468008484864","Bd09live#1901","05-Aug-22 05:06 PM","instead of just skipping them","",""
"212020468008484864","Bd09live#1901","05-Aug-22 05:13 PM","we are looking for a person right?","",""
"212020468008484864","Bd09live#1901","05-Aug-22 05:13 PM","cause this didnt give me a person","",""
"263703743411912707","volt64bolt#2496","05-Aug-22 05:13 PM","i think we are looking for a person to contact","",""
"263703743411912707","volt64bolt#2496","05-Aug-22 05:13 PM","i still think there are 2 ways to solve it, contact a certain person, or find where its buried","",""
"304702455755571200","sinead#6824","05-Aug-22 05:14 PM","a person, an action/way of 'spouting' the phrase I guess","",""
"212020468008484864","Bd09live#1901","05-Aug-22 05:14 PM","so i redid up to treasure hunt (including the dang fish) using the masquerade thing (well the best i could)","",""
"212020468008484864","Bd09live#1901","05-Aug-22 05:14 PM","S L A H E W S Y B M S (or A) T A S","",""
"263703743411912707","volt64bolt#2496","05-Aug-22 05:14 PM","time to put that into some cipghers","",""
"263703743411912707","volt64bolt#2496","05-Aug-22 05:15 PM","ciphers","",""
"212020468008484864","Bd09live#1901","05-Aug-22 05:15 PM","seperating it into digestable chunks you can get whales by masts","",""
"767334862071529483","C47UMX#7091","05-Aug-22 05:15 PM","https://discord.gg/fyeUUpzb","",""
"263703743411912707","volt64bolt#2496","05-Aug-22 05:15 PM","no","",""
"263703743411912707","volt64bolt#2496","05-Aug-22 05:16 PM","hmm","",""
"263703743411912707","volt64bolt#2496","05-Aug-22 05:16 PM","where are there whales in the uk","",""
"212020468008484864","Bd09live#1901","05-Aug-22 05:16 PM","i live in midwest usa, i have no bloody clue","",""
"263703743411912707","volt64bolt#2496","05-Aug-22 05:16 PM","","https://cdn.discordapp.com/attachments/1004807688636612698/1005132180122521684/unknown.png",""
"606278440647393291","teesus#1152","05-Aug-22 05:16 PM","well there is literally a place called wales","",""
"263703743411912707","volt64bolt#2496","05-Aug-22 05:16 PM","time to see if any have masts","",""
"212020468008484864","Bd09live#1901","05-Aug-22 05:17 PM","this could be just me failing at this so do not expect much to come from it","",""
"394874082618769409","ollie#3373","05-Aug-22 05:17 PM","still looks like thats skipping some letters to me","",""
"212020468008484864","Bd09live#1901","05-Aug-22 05:17 PM","it uses all the letters i have at that point","",""
"394874082618769409","ollie#3373","05-Aug-22 05:18 PM","if this puzzle is genuinely to be solved in the same way as masquerade, this whole video has to have been planned out perfectly for it to line up with subtitles - i dont think thats the case honestly","",""
"394874082618769409","ollie#3373","05-Aug-22 05:18 PM","not saying it should be ruled out but it would be quite an extraordinary effort","",""
"212020468008484864","Bd09live#1901","05-Aug-22 05:18 PM","well if someone wants to attempt the song (where he wont stop freaking bouncing around","",""
"263703743411912707","volt64bolt#2496","05-Aug-22 05:19 PM","we are all overlooking something i think","",""
"394874082618769409","ollie#3373","05-Aug-22 05:20 PM","well yes obviously lol","",""
"427532626488983552","H26#7420","05-Aug-22 05:31 PM","Isn’t that the point, work out the simple key and solve the clue.","",""
"263703743411912707","volt64bolt#2496","05-Aug-22 05:31 PM","yes","",""
"971510295308668968","Kiera#7641","05-Aug-22 05:51 PM","i thought i recognised ur name your the minecraft vfx guy right?","",""
"263703743411912707","volt64bolt#2496","05-Aug-22 05:52 PM","yes!!!","",""
"263703743411912707","volt64bolt#2496","05-Aug-22 05:52 PM","i have completed my life goal!!! being recognised for something!!!!","",""
"971510295308668968","Kiera#7641","05-Aug-22 05:52 PM","lmao haha","",""
"971510295308668968","Kiera#7641","05-Aug-22 05:53 PM","yeah i watched your tutorial haha","",""
"263703743411912707","volt64bolt#2496","05-Aug-22 05:54 PM","haha, thanks!","",""
"272235825498947594","Gifting aka DaffinTheDuck#9058","05-Aug-22 05:55 PM","Check bio for clues","",""
"184811443462471680","T334#0334","05-Aug-22 05:58 PM","?","",""
"314860237565722634","Josef_C_12#1352","05-Aug-22 06:46 PM","Heavenly Father, I am grateful for the universe. I ask thee humbly, please help me find the Gold Fosh.
In the name of Jesus Christ, Amen.

The clue is religion/faith/divinity","",""
"263703743411912707","volt64bolt#2496","05-Aug-22 06:47 PM","the fish god has it","",""
"314860237565722634","Josef_C_12#1352","05-Aug-22 06:48 PM","... isn't it, though?","",""
"387552714017603585","Omichromium#8008","05-Aug-22 06:49 PM","What","",""
"314860237565722634","Josef_C_12#1352","05-Aug-22 06:49 PM","The lyrics as well","",""
"263703743411912707","volt64bolt#2496","05-Aug-22 06:49 PM","POWER TO THE FISH GODS","",""
"387552714017603585","Omichromium#8008","05-Aug-22 06:49 PM","I PRAY TO THE FISH GODS","",""
"314860237565722634","Josef_C_12#1352","05-Aug-22 06:50 PM","Neighbour on the bus or a dear old queen, with the possibility the world is packed. - God/Divinity is in everyone.
But the keeper of the secret is not close to Max. - Max is not close to a God/Divine at all - keeper of the secret is divine Jesus/God
That's beyond a fact - because it has nothing to do with fact, but with faith.","",""
"314860237565722634","Josef_C_12#1352","05-Aug-22 06:50 PM","The video shows Chapel, married man(the ring), and a religious relic (also the way he holds it)","",""
"263703743411912707","volt64bolt#2496","05-Aug-22 06:51 PM","but how does that give us an answer","",""
"387552714017603585","Omichromium#8008","05-Aug-22 06:51 PM","I genuinely cant tell if youre taking the piss man","",""
"314860237565722634","Josef_C_12#1352","05-Aug-22 06:51 PM","What do you mean","",""
"263703743411912707","volt64bolt#2496","05-Aug-22 06:51 PM","you didnt pray to the fish gods","",""
"263703743411912707","volt64bolt#2496","05-Aug-22 06:51 PM","thats why","",""
"314860237565722634","Josef_C_12#1352","05-Aug-22 06:52 PM","It's literally a religious relic","",""
"263703743411912707","volt64bolt#2496","05-Aug-22 06:52 PM","yeh","",""
"617014907518451713","Rufus#5754","05-Aug-22 06:52 PM","Let's goooo","",""
"263703743411912707","volt64bolt#2496","05-Aug-22 06:52 PM","PRAISE THE FISH GODS","",""
"387552714017603585","Omichromium#8008","05-Aug-22 06:53 PM","Wait i recognise your username","",""
"387552714017603585","Omichromium#8008","05-Aug-22 06:53 PM","OH YEAH YOU DID THE MOLTEN GOLD THING","",""
"263703743411912707","volt64bolt#2496","05-Aug-22 06:54 PM","yep, and the first tutorials on it all","",""
"387552714017603585","Omichromium#8008","05-Aug-22 06:55 PM","Holy shit dude","",""
"857256807839957003","Poppins#7134","05-Aug-22 07:12 PM","poop","",""
"512709309298114574","KommunistKoala#9657","05-Aug-22 07:21 PM","pooop","",""
"310995839608815617","DARTHLVADER#3772","05-Aug-22 07:30 PM","chat two hold the most productive fish hunters","",""
"263703743411912707","volt64bolt#2496","05-Aug-22 07:31 PM","it used to","",""
"263703743411912707","volt64bolt#2496","05-Aug-22 07:31 PM","but now its fish gods ad poop","",""
"409016010159554560","jaxxx#3499","05-Aug-22 08:10 PM","","https://cdn.discordapp.com/attachments/1004807688636612698/1005175868311736340/IMG_1052.png",""
"270833265898815498","Skotte#5170","05-Aug-22 08:33 PM","Why is it everyone isnt reading the riddle right?","","🤔 (3)"
"580423864492884002","Pseudo#9518","05-Aug-22 08:36 PM","whats the right way to read it?","","😆 (1)"
"801827263044911176","Baib#1462","05-Aug-22 08:37 PM","with ya fuckin eyes","",""
"580423864492884002","Pseudo#9518","05-Aug-22 08:38 PM","shit, i read it with my toes","",""
"801827263044911176","Baib#1462","05-Aug-22 08:38 PM","TOES","",""
"270833265898815498","Skotte#5170","05-Aug-22 08:51 PM","dm me","","🤣 (1)"
"1004912146578145340","Gunther#6943","05-Aug-22 09:06 PM","Might be a red herring but if you search the song through Google it matches with a song called ""Masquerade"" which is the book that Joanna referred to. The matching song is from ""Phantom of the Opera"" which could relate to ""that's beyond a fact""","",""
"988688611597766707","jackh1#6251","05-Aug-22 09:07 PM","","https://cdn.discordapp.com/attachments/1004807688636612698/1005190208150589491/IMG_0384.png",""
"246725187737747456","twinightcreep0#0098","05-Aug-22 09:08 PM","how could it relate to that's beyond a fact?","",""
"1004912146578145340","Gunther#6943","05-Aug-22 09:10 PM","Because it's fictional","","🤣 (1)"
"246725187737747456","twinightcreep0#0098","05-Aug-22 09:11 PM","eh ok","",""
"811990176528072756","stainingdream#9170","05-Aug-22 09:11 PM","Who cna call","",""
"741411931025440861","Maxi98#0671","05-Aug-22 09:21 PM","does this have any meaning?","https://cdn.discordapp.com/attachments/1004807688636612698/1005193834055077949/unknown.png",""
"1004842635833397298","xXFireside_New#8561","05-Aug-22 09:25 PM","its just art work","",""
"741411931025440861","Maxi98#0671","05-Aug-22 09:25 PM","Hmm ^^ But the text makes sense as well for our situations XD","",""
"537004555259478025","Jen [her]#1435","05-Aug-22 10:59 PM","its a piece by mr brainwash, of *Exit Through The Giftshop* fame (or a print of it)","",""
"843422076228206592","GeorgeSLYY#9950","05-Aug-22 11:42 PM","","https://cdn.discordapp.com/attachments/1004807688636612698/1005229272656515102/unknown.png",""
"761664600571379785","flyingdutchboy1#1415","05-Aug-22 11:48 PM","Where's this from @Geeg","",""
"327848238092910593","ObsidianHoax#2049","05-Aug-22 11:52 PM","made up","",""
"988688611597766707","jackh1#6251","05-Aug-22 11:54 PM","Real","",""
"773635926349971456","Ollie5050#0887","05-Aug-22 11:56 PM","The websites not real","",""
"773635926349971456","Ollie5050#0887","05-Aug-22 11:57 PM","I’d bet the price if that fish that it’s not real","",""
"263703743411912707","volt64bolt#2496","05-Aug-22 11:57 PM","That’s a lie, the poster has no friends","",""
"263703743411912707","volt64bolt#2496","05-Aug-22 11:57 PM","I will take you up on that","",""
"263703743411912707","volt64bolt#2496","05-Aug-22 11:57 PM","Because the site is real, just not correct","",""
"263703743411912707","volt64bolt#2496","05-Aug-22 11:57 PM","It is an existing thing","",""
"263703743411912707","volt64bolt#2496","05-Aug-22 11:57 PM","Hence it’s real","",""
"270833265898815498","Skotte#5170","05-Aug-22 11:57 PM","what is the thing you have to write on the site to make the text pop up","",""
"263703743411912707","volt64bolt#2496","05-Aug-22 11:57 PM","Now give me my moneys","",""
"263703743411912707","volt64bolt#2496","05-Aug-22 11:57 PM","Just ignore the site","",""
"270833265898815498","Skotte#5170","05-Aug-22 11:58 PM","I have an idea","",""
"327848238092910593","ObsidianHoax#2049","05-Aug-22 11:58 PM","ok","",""
"773635926349971456","Ollie5050#0887","05-Aug-22 11:58 PM","…","",""
"263703743411912707","volt64bolt#2496","05-Aug-22 11:59 PM","I hate it when people go “I have an idea” or “I think i worked it out” or “I think I found a clue” JUST TELL US THE GODAM THING YOUR GONNA SAY, STOP WITH THE INTERMEDIARY MESS","",""
"263703743411912707","volt64bolt#2496","05-Aug-22 11:59 PM","it is a pet hate of mine","",""
"327848238092910593","ObsidianHoax#2049","05-Aug-22 11:59 PM","I still think the wink","",""
"263703743411912707","volt64bolt#2496","05-Aug-22 11:59 PM","Intermediary comments that provide nothing","",""
"784825209407799297","RoGarf#7848","05-Aug-22 11:59 PM","For anyone who's wondering about Cryptic Clues, this is a great video to watch! https://www.youtube.com/watch?v=q7Lfv-Z6sho","",""
"263703743411912707","volt64bolt#2496","05-Aug-22 11:59 PM","I would agree","",""
"784825209407799297","RoGarf#7848","05-Aug-22 11:59 PM","(And yes, it's not a rick roll or anything malicious.)","",""
"263703743411912707","volt64bolt#2496","05-Aug-22 11:59 PM","But I watched it, and nothing stood out","",""
"263703743411912707","volt64bolt#2496","06-Aug-22 12:00 AM","Nah it’s cracking the cryptic isn’t it?","",""
"784825209407799297","RoGarf#7848","06-Aug-22 12:00 AM","Really?","",""
"784825209407799297","RoGarf#7848","06-Aug-22 12:00 AM","Yeah.","",""
"263703743411912707","volt64bolt#2496","06-Aug-22 12:00 AM","Yeh apart from like 1 or 2 mean less things, most of the song lyrics just don’t hide much","",""
"784825209407799297","RoGarf#7848","06-Aug-22 12:00 AM","Hmm...","",""
