AuthorID,Author,Date,Content,Attachments,Reactions
"716556106435919882","ThreadedV5#5717","06-Aug-22 02:03 AM","yh ik","",""
"716556106435919882","ThreadedV5#5717","06-Aug-22 02:03 AM","Ok","",""
"716556106435919882","ThreadedV5#5717","06-Aug-22 02:03 AM","Aight then","",""
"716556106435919882","ThreadedV5#5717","06-Aug-22 02:03 AM","Dance in a crazy way","",""
"716556106435919882","ThreadedV5#5717","06-Aug-22 02:04 AM","You’d think tiktoks","",""
"716556106435919882","ThreadedV5#5717","06-Aug-22 02:04 AM","But there’s also nightclubs?","",""
"95147651565101056","zabraih#3296","06-Aug-22 02:04 AM","it has to be wordplay","",""
"716556106435919882","ThreadedV5#5717","06-Aug-22 02:04 AM","Parties","",""
"136625121308835840","Drew#5969","06-Aug-22 02:04 AM","i would think wordplay","",""
"716556106435919882","ThreadedV5#5717","06-Aug-22 02:04 AM","Yh ok","",""
"894566161973411850","vroo#7460","06-Aug-22 02:04 AM","He says/mouths something at 4:27 ish that you can't hear but I can't tell what he says","",""
"95147651565101056","zabraih#3296","06-Aug-22 02:05 AM","the mouthing thing seems like he is just talking to the camera man","",""
"425406514782797831","Senzubean#3538","06-Aug-22 02:05 AM","@Drew I think you are right. espescially if you take into account what that lady said about the treasure hunt being based of the book Masquerade by kit williams","",""
"716556106435919882","ThreadedV5#5717","06-Aug-22 02:05 AM","perhaps rock?","",""
"425406514782797831","Senzubean#3538","06-Aug-22 02:07 AM","","https://cdn.discordapp.com/attachments/1004807688636612698/1005265701986111601/unknown.png",""
"566723219088736287","BlairTempest#8218","06-Aug-22 02:07 AM","don't do this to me T-T","",""
"566723219088736287","BlairTempest#8218","06-Aug-22 02:08 AM","sadly I've checked that","",""
"566723219088736287","BlairTempest#8218","06-Aug-22 02:08 AM","I spent hours looking into that book","",""
"425406514782797831","Senzubean#3538","06-Aug-22 02:08 AM","xD","",""
"136625121308835840","Drew#5969","06-Aug-22 02:09 AM","she also says ""within the lyrics will be clues to where you will be able to find this goldfish""","",""
"894566161973411850","vroo#7460","06-Aug-22 02:09 AM","Seems strange they'd leave it in if that was so 🤷‍♀️","",""
"95147651565101056","zabraih#3296","06-Aug-22 02:10 AM","yes! cryptic crossword methood","",""
"136625121308835840","Drew#5969","06-Aug-22 02:10 AM","yes","",""
"95147651565101056","zabraih#3296","06-Aug-22 02:10 AM","sadly I can't seem to figure anything out 😄","",""
"136625121308835840","Drew#5969","06-Aug-22 02:10 AM","well nobody has","",""
"95147651565101056","zabraih#3296","06-Aug-22 02:10 AM","""In the name of Max Fosh, dish out the fish"" - cryptic clue for remove","",""
"127879348463075338","Them#5529","06-Aug-22 02:11 AM","Im not to confident in the cryptic crossword method after a day of trying to crack it","",""
"136625121308835840","Drew#5969","06-Aug-22 02:11 AM","i've thought about this also","",""
"95147651565101056","zabraih#3296","06-Aug-22 02:11 AM","""with the possibility the world is packed"" - cryptic clue for word within a word","",""
"136625121308835840","Drew#5969","06-Aug-22 02:11 AM","remove ""the fish"" from the letters of his name? his full name? the name within his name (his middle name)?","",""
"95147651565101056","zabraih#3296","06-Aug-22 02:11 AM","but that;s all i got","",""
"136625121308835840","Drew#5969","06-Aug-22 02:11 AM","dont know","",""
"95147651565101056","zabraih#3296","06-Aug-22 02:11 AM","middle name is arthur","",""
"894566161973411850","vroo#7460","06-Aug-22 02:11 AM","""in the name of max fosh"" his catchphrase is silly to the max 🤷‍♀️","",""
"127879348463075338","Them#5529","06-Aug-22 02:11 AM","this is what makes me think its not","",""
"433621333880864790","Strick#8905","06-Aug-22 02:11 AM","His full name does have the letters in it for marlin. A type of fish","",""
"1005054608835625021","Otts#2089","06-Aug-22 02:12 AM","yk the joanna hardy insta caption - she makes a big deal out of 'the back being the front'. Could be nothing but is that any clue towards reading anything backwards","","💯 (1)"
"95147651565101056","zabraih#3296","06-Aug-22 02:12 AM","I don't think joanna knows the solution","",""
"95147651565101056","zabraih#3296","06-Aug-22 02:12 AM","he says in the video even she can participate","",""
"894566161973411850","vroo#7460","06-Aug-22 02:13 AM","Was Joanna hardy one of the jewelers who ""evaluated"" it?","","👍 (1)"
"1005054608835625021","Otts#2089","06-Aug-22 02:13 AM","ah right ok","",""
"1005054608835625021","Otts#2089","06-Aug-22 02:13 AM","not sure haha just jumped on and saw it","",""
"95147651565101056","zabraih#3296","06-Aug-22 02:13 AM","ngl this is closest thing to a clue I've seen in a long time","",""
"95147651565101056","zabraih#3296","06-Aug-22 02:13 AM","😄","",""
"136625121308835840","Drew#5969","06-Aug-22 02:13 AM","his full name also has the letters for salmon","",""
"127879348463075338","Them#5529","06-Aug-22 02:14 AM","I literally spent all day trying to come up with synonyms for world, possilibty and bus passenger","",""
"894566161973411850","vroo#7460","06-Aug-22 02:14 AM","What's his full name?","",""
"95147651565101056","zabraih#3296","06-Aug-22 02:14 AM","i feel like the possibility is just one of ""neighbour on the bus or a dear old queen""","",""
"433621333880864790","Strick#8905","06-Aug-22 02:14 AM","Maxwell Fishflaps Fosh","",""
"127879348463075338","Them#5529","06-Aug-22 02:14 AM","Because it just cant be world inside of possibility","",""
"95147651565101056","zabraih#3296","06-Aug-22 02:14 AM","and we have to ""pack"" it in a word for world","",""
"249654040827265026","Mercon#0157","06-Aug-22 02:14 AM","","https://cdn.discordapp.com/attachments/1004807688636612698/1005267689880686672/unknown.png",""
"249654040827265026","Mercon#0157","06-Aug-22 02:15 AM","#sorrylatetotheclueparty","",""
"95147651565101056","zabraih#3296","06-Aug-22 02:15 AM","Maximilian Arthur ""Max"" Fosh","",""
"425406514782797831","Senzubean#3538","06-Aug-22 02:15 AM","yeah you send the email XD","","noice (1)"
"894566161973411850","vroo#7460","06-Aug-22 02:15 AM","Thanks","",""
"310995839608815617","DARTHLVADER#3772","06-Aug-22 02:15 AM","has anyone confirmed what the song this is being played to is?","",""
"95147651565101056","zabraih#3296","06-Aug-22 02:16 AM","doesn't matter what the song is, english and bit of google is what he said","",""
"95147651565101056","zabraih#3296","06-Aug-22 02:16 AM","and it seems to be an original song","",""
"490830527423709184","CroataAR#8012","06-Aug-22 02:17 AM","so anyone think about ""the WORLD is packed"" as a package to deliver ? is there any site like fedex or UPS that deliver things with like a sentence or a password to retrieve the package ?","",""
"310995839608815617","DARTHLVADER#3772","06-Aug-22 02:18 AM","I tought it was original","",""
"894566161973411850","vroo#7460","06-Aug-22 02:18 AM","If you type Maximilian Arthur fosh into a decrypted you get ""%����2Nt��Nk�����`�P����"" which if you put into Google you get ""Stirling's formula"" Stirling is the money used in the UK and the whole video relates to the evaluation of the fish","",""
"894566161973411850","vroo#7460","06-Aug-22 02:19 AM","Decrypter*","",""
"894566161973411850","vroo#7460","06-Aug-22 02:19 AM","Stirling's approximation*","",""
"95147651565101056","zabraih#3296","06-Aug-22 02:19 AM","he can't control that though","",""
"972180903826714634","Boomyday#9679","06-Aug-22 02:19 AM","this also links to dear old queen","",""
"894566161973411850","vroo#7460","06-Aug-22 02:19 AM","Approximation being what they tried to value it at","",""
"894566161973411850","vroo#7460","06-Aug-22 02:19 AM","And they couldn't do if","",""
"894566161973411850","vroo#7460","06-Aug-22 02:19 AM","Unless he used it to his advantage that that happens","",""
"716556106435919882","ThreadedV5#5717","06-Aug-22 02:23 AM","That’s beyond a fact","",""
"716556106435919882","ThreadedV5#5717","06-Aug-22 02:23 AM","In what way is it beyond?","",""
"894566161973411850","vroo#7460","06-Aug-22 02:24 AM","What's more than a fact","",""
"716556106435919882","ThreadedV5#5717","06-Aug-22 02:24 AM","Nothing","",""
"894566161973411850","vroo#7460","06-Aug-22 02:24 AM","Or bigger than a fact","",""
"716556106435919882","ThreadedV5#5717","06-Aug-22 02:24 AM","Fact is fact","",""
"716556106435919882","ThreadedV5#5717","06-Aug-22 02:24 AM","truth","",""
"716556106435919882","ThreadedV5#5717","06-Aug-22 02:24 AM","God like stuff","",""
"716556106435919882","ThreadedV5#5717","06-Aug-22 02:25 AM","The keeper of the secret is not close to max","",""
"716556106435919882","ThreadedV5#5717","06-Aug-22 02:25 AM","And that’s beyond a fact","",""
"95147651565101056","zabraih#3296","06-Aug-22 02:26 AM","what if you just put the 2 togheter","",""
"95147651565101056","zabraih#3296","06-Aug-22 02:27 AM","not close to max - so like minimum or smth
and fact - truth or smth","",""
"894566161973411850","vroo#7460","06-Aug-22 02:27 AM","So it's certain that the keeper of the secret is no where near max?","",""
"95147651565101056","zabraih#3296","06-Aug-22 02:27 AM","i really want this to make sense but it just doesn't","",""
"716556106435919882","ThreadedV5#5717","06-Aug-22 02:27 AM","I think it can be either
Close emotionally, the keeper has no ties with Max
Or close geographically, the keeper isn’t near Max","",""
"716556106435919882","ThreadedV5#5717","06-Aug-22 02:28 AM","Beyond a fact could imply both being true","",""
"716556106435919882","ThreadedV5#5717","06-Aug-22 02:28 AM","But it doesn’t really work","",""
"894566161973411850","vroo#7460","06-Aug-22 02:28 AM","The keeper must have ties with max go acknowledge the clue. There's no way he could just scan another person's comments, right?","",""
"894566161973411850","vroo#7460","06-Aug-22 02:28 AM","To","",""
"716556106435919882","ThreadedV5#5717","06-Aug-22 02:28 AM","Yes","",""
"716556106435919882","ThreadedV5#5717","06-Aug-22 02:28 AM","Sorry my wording is bad","",""
"716556106435919882","ThreadedV5#5717","06-Aug-22 02:29 AM","The keeper doesn’t have a deep relationship with max/ isn’t very close","",""
"716556106435919882","ThreadedV5#5717","06-Aug-22 02:29 AM","Could just be a business deal set up","",""
"716556106435919882","ThreadedV5#5717","06-Aug-22 02:29 AM","Like a dm saying can you be the secret keeper","",""
"512709309298114574","KommunistKoala#9657","06-Aug-22 02:29 AM","beyond a fact -> truth, given, axiom, faith, obvious or maybe its a word that comes a little after 'fact' in the dictionary","",""
"716556106435919882","ThreadedV5#5717","06-Aug-22 02:31 AM","Those are synonyms so they’re not really beyond a fact, I like the dictionary idea tho","",""
"894566161973411850","vroo#7460","06-Aug-22 02:33 AM","All I can find after fact in a dictionary is factor, faculty, then fail","",""
"716556106435919882","ThreadedV5#5717","06-Aug-22 02:34 AM","YO I THINK IVE GOT IT","","❓ (2)"
"716556106435919882","ThreadedV5#5717","06-Aug-22 02:34 AM","We’re doing it right now","",""
"716556106435919882","ThreadedV5#5717","06-Aug-22 02:34 AM","FAILING","",""
"716556106435919882","ThreadedV5#5717","06-Aug-22 02:34 AM","ah nvm","",""
"716556106435919882","ThreadedV5#5717","06-Aug-22 02:34 AM","I’m gonna go crazy","","😔 (1)"
"894566161973411850","vroo#7460","06-Aug-22 02:35 AM","Yes we are indeed failing. FeelsBadMan","",""
"512709309298114574","KommunistKoala#9657","06-Aug-22 02:38 AM","in his previous poem he had the line ""and thats all we'll give' to confirm the clue maximum so i reckon and thats beyond a fact may fufill a similar role","","👌 (1)"
"716556106435919882","ThreadedV5#5717","06-Aug-22 02:40 AM","Since when was it a diamond treasure?","",""
"716556106435919882","ThreadedV5#5717","06-Aug-22 02:40 AM","Or was it always and I’m a fool","",""
"894566161973411850","vroo#7460","06-Aug-22 02:41 AM","What do you mean","",""
"400424602045513728","Richpip2002#7929","06-Aug-22 02:43 AM","It has some diamonds in it","",""
"716556106435919882","ThreadedV5#5717","06-Aug-22 02:43 AM","oh ok","",""
"400424602045513728","Richpip2002#7929","06-Aug-22 02:44 AM","I literally was awake till 3am last night with with the fake website and the fake clue going around my mind!","",""
"716556106435919882","ThreadedV5#5717","06-Aug-22 02:45 AM","L","",""
"716556106435919882","ThreadedV5#5717","06-Aug-22 02:45 AM","The world is packed
The world wide web with packets being sent aroundv","",""
"716556106435919882","ThreadedV5#5717","06-Aug-22 02:45 AM","?","",""
"716556106435919882","ThreadedV5#5717","06-Aug-22 02:46 AM","Data is typically split into little “packets” when transferring across the internet btw","",""
"935595704213184553","lambshucks#0142","06-Aug-22 02:51 AM","youd need to have knowledge of how the web works to figure that out and he stated that anyone could get it so that seems like a stretch","",""
"894566161973411850","vroo#7460","06-Aug-22 02:53 AM","","https://cdn.discordapp.com/attachments/1004807688636612698/1005277474688602193/IMG_20220806_015235.jpg",""
"894566161973411850","vroo#7460","06-Aug-22 02:54 AM","Really clutching at straws but that looks like S O D to me","",""
"894566161973411850","vroo#7460","06-Aug-22 02:54 AM","Sob maybe?","",""
"566723219088736287","BlairTempest#8218","06-Aug-22 02:55 AM","that won't be it","",""
"716556106435919882","ThreadedV5#5717","06-Aug-22 02:56 AM","The fact that I have no clue what sod means tells you this can’t be it","",""
"184811443462471680","T334#0334","06-Aug-22 02:57 AM","poor sod","",""
"894566161973411850","vroo#7460","06-Aug-22 02:59 AM","Yeah I'm just completely lost so I'm trying anything I can think of and just seeing things","",""
"894566161973411850","vroo#7460","06-Aug-22 03:00 AM","I think I need to sleep and come at it with a fresh mind tomorrow.","",""
"894566161973411850","vroo#7460","06-Aug-22 03:00 AM","But there's no way I could sleep without at least having discovered something","",""
"894566161973411850","vroo#7460","06-Aug-22 03:01 AM","It feels like an arg but the clues are completely different","",""
"400424602045513728","Richpip2002#7929","06-Aug-22 03:03 AM","I’ve just tried something the sound says, in the Name of max fosh, so I have filled an online form saying I’m max fosh with the message dish out the fish - seems too easyyy","",""
"894566161973411850","vroo#7460","06-Aug-22 03:04 AM","What form?","",""
"400424602045513728","Richpip2002#7929","06-Aug-22 03:04 AM","If I win the fish I’ll let you know lol","",""
"894566161973411850","vroo#7460","06-Aug-22 03:04 AM","Fair enough lol","",""
"400424602045513728","Richpip2002#7929","06-Aug-22 03:04 AM","Don’t want it being spammed","",""
"894566161973411850","vroo#7460","06-Aug-22 03:04 AM","Yeah fair","",""
"851461006911209514","dingdangdoo#9612","06-Aug-22 03:13 AM","You are clutching at straws","",""
"851461006911209514","dingdangdoo#9612","06-Aug-22 03:13 AM","Read the words from the song!","",""
"142953170396643328","Mikee#5346","06-Aug-22 03:13 AM","hot guess: the form on the website?","",""
"400424602045513728","Richpip2002#7929","06-Aug-22 03:16 AM","No I’m not a believer of the what is silly song show website","",""
"894566161973411850","vroo#7460","06-Aug-22 03:17 AM","Does anyone know morse code?","",""
"894566161973411850","vroo#7460","06-Aug-22 03:17 AM","If you go to the promo and turn the volume up really high on headphones it sounds like tapping in morse code","",""
"400424602045513728","Richpip2002#7929","06-Aug-22 03:18 AM","You sure you not just picking up the tapping on the ivory’s?","",""
"666364986268057620","TheOneAndOnly#5140","06-Aug-22 03:19 AM","DID ANYONE CATCH THIS?!","https://cdn.discordapp.com/attachments/1004807688636612698/1005283843676319744/unknown.png,https://cdn.discordapp.com/attachments/1004807688636612698/1005283843948941422/unknown.png",""
"566723219088736287","BlairTempest#8218","06-Aug-22 03:19 AM","yes","",""
"666364986268057620","TheOneAndOnly#5140","06-Aug-22 03:19 AM","oh 😦","",""
"566723219088736287","BlairTempest#8218","06-Aug-22 03:19 AM","sadly it's a bit old","",""
"894566161973411850","vroo#7460","06-Aug-22 03:19 AM","What's it from?","",""
"142953170396643328","Mikee#5346","06-Aug-22 03:19 AM","catch what?","",""
"666364986268057620","TheOneAndOnly#5140","06-Aug-22 03:19 AM","https://www.maxfosh.co/","",""
"666364986268057620","TheOneAndOnly#5140","06-Aug-22 03:19 AM","from here","",""
"666364986268057620","TheOneAndOnly#5140","06-Aug-22 03:20 AM","it says ""In the name of Max Fosh, dish out the fish""","",""
"142953170396643328","Mikee#5346","06-Aug-22 03:20 AM","no it doesn't","",""
"894566161973411850","vroo#7460","06-Aug-22 03:21 AM","It doesn't say it on the website anymore. It finishes after ruddy cheers from what I can see","",""
"666364986268057620","TheOneAndOnly#5140","06-Aug-22 03:21 AM","^","",""
"666364986268057620","TheOneAndOnly#5140","06-Aug-22 03:21 AM","@BlairTempest said it was an old find apparently","",""
"666364986268057620","TheOneAndOnly#5140","06-Aug-22 03:21 AM","👀","",""
"566723219088736287","BlairTempest#8218","06-Aug-22 03:22 AM","that's just what I believe so take it with a grain of salt, it's still worth looking at","",""
"894566161973411850","vroo#7460","06-Aug-22 03:22 AM","Quite possibly but maybe worth checking?","",""
"666364986268057620","TheOneAndOnly#5140","06-Aug-22 03:23 AM","im certain the website is running some sort of A/B testing, some ppl see it others dont","","🤡 (1)"
"666364986268057620","TheOneAndOnly#5140","06-Aug-22 03:24 AM","@Mikee check network","",""
"666364986268057620","TheOneAndOnly#5140","06-Aug-22 03:24 AM","run through proxy or something","",""
"142953170396643328","Mikee#5346","06-Aug-22 03:24 AM","xd","",""
"400424602045513728","Richpip2002#7929","06-Aug-22 03:24 AM","May be someone has won and that’s why it’s been removed","",""
"666364986268057620","TheOneAndOnly#5140","06-Aug-22 03:25 AM","nah guys i was only joking","",""
"894566161973411850","vroo#7460","06-Aug-22 03:25 AM","I'd have thought he'd announce it instantly if someone had been confirmed the winner . Otherwise he's just wasting peoples time","",""
"666364986268057620","TheOneAndOnly#5140","06-Aug-22 03:25 AM","i cant sleep knowing i screwed bare people on a wrong lead","",""
"400424602045513728","Richpip2002#7929","06-Aug-22 03:27 AM","Haha this is just cruel 🤣 I’m so tired I’d believe max is a fish called trout","",""
"894566161973411850","vroo#7460","06-Aug-22 03:27 AM","Lmao","",""
"666364986268057620","TheOneAndOnly#5140","06-Aug-22 03:28 AM","xd","",""
"400424602045513728","Richpip2002#7929","06-Aug-22 03:31 AM","I’m going to leave you lovely treasure hunters and get some sleep so I can for once an all solve this tomorrow 🤣","",""
"894566161973411850","vroo#7460","06-Aug-22 03:32 AM","Gonna do the same cause I can barely think straight at the minute. Gn all","",""
"425781285433114644","UnclePockets#0710","06-Aug-22 03:57 AM","I assume based off the song you have to message someone. so Id also assume as soon as someone does that the perosn will contact max and them them know","",""
"425406514782797831","Senzubean#3538","06-Aug-22 04:12 AM","I think rather than a person, probably a website or mail adress with automatic reply","","👍 (1)"
"763389170583732275","SaAnd#6075","06-Aug-22 04:57 AM","I was in the middle of reading that","",""
"965125026254848010","Steak_286#1091","06-Aug-22 05:11 AM",":fishfosh:","",""
"965125026254848010","Steak_286#1091","06-Aug-22 05:12 AM","nvm that did nothing","",""
"272235825498947594","Gifting aka DaffinTheDuck#9058","06-Aug-22 05:53 AM","check my bio for a clues thing. We have a channel and brainstormed so much stuff. If people go through it they may be able to inch forward","",""
"433621333880864790","Strick#8905","06-Aug-22 11:41 AM","🧢","",""
"149659191575969792","hairdyeginger#4861","06-Aug-22 12:26 PM","Literally just fuck off","",""
"64379605808590848","Atral#7130","06-Aug-22 12:47 PM","lmao","https://cdn.discordapp.com/attachments/1004807688636612698/1005426929828110337/unknown.png",""
"1002478773255553096","goldfoshhunter#5960","06-Aug-22 12:58 PM","When is it expected to be announced?","",""
"64379605808590848","Atral#7130","06-Aug-22 01:01 PM","when someone solves it","",""
"988688611597766707","jackh1#6251","06-Aug-22 01:05 PM","","https://cdn.discordapp.com/attachments/1004807688636612698/1005431371294068818/IMG_0389.png",""
"1005151576647802993","authyris#5194","06-Aug-22 01:05 PM","Where's that from?","",""
"988688611597766707","jackh1#6251","06-Aug-22 01:06 PM","His website","",""
"339839814310428675","mewthree316#6114","06-Aug-22 01:15 PM","It’s true","",""
"425406514782797831","Senzubean#3538","06-Aug-22 01:30 PM","thats his company name","",""
"417383214295023627","Moonagejames#1476","06-Aug-22 01:59 PM","This is edited","",""
"199218077412360192","DeepStatic#0751","06-Aug-22 02:08 PM","Have you guys seen this?","https://cdn.discordapp.com/attachments/1004807688636612698/1005447169031032842/unknown.png",""
"536290766440628254","Skyhunter#3221","06-Aug-22 02:10 PM","it? if so got a link? 😄","",""
"536290766440628254","Skyhunter#3221","06-Aug-22 02:10 PM","*is it legit","",""
"591001462213967935","Geodim#6435","06-Aug-22 02:11 PM","this isnt legit","",""
"142953170396643328","Mikee#5346","06-Aug-22 02:11 PM","Hahaha true","",""
"142953170396643328","Mikee#5346","06-Aug-22 02:12 PM","I think they're joking","",""
"591001462213967935","Geodim#6435","06-Aug-22 02:12 PM","send a link though i wanna read it","",""
"142953170396643328","Mikee#5346","06-Aug-22 02:12 PM","It's his website","",""
"691464383758467073","alexakasasha#3244","06-Aug-22 02:18 PM","just with the last part added by someone trolling","",""
"199218077412360192","DeepStatic#0751","06-Aug-22 02:21 PM","Consider it anti trolling. It was in response to this: https://discord.com/channels/843521269085241384/1004807688636612698/1005283845043671093","",""
"666364986268057620","TheOneAndOnly#5140","06-Aug-22 03:11 PM","Tbh I did mention I was trolling","",""
"666364986268057620","TheOneAndOnly#5140","06-Aug-22 03:11 PM",":pog:","",""
"718028636275605604","Marz#3086","06-Aug-22 05:24 PM",":redherring:","",""
"566723219088736287","BlairTempest#8218","06-Aug-22 07:08 PM","@MrDKOz sorry if you've answered this, but it's hard to see the cuts in the video, like what's said on your website, are there really cuts?","",""
"158854267355004928","MrDKOz#5383","06-Aug-22 07:12 PM","I did go through them when I wrote it and could've sworn it was right - odd. I'll go through them again and move the cuts.","","👍 (1)"
"158854267355004928","MrDKOz#5383","06-Aug-22 07:15 PM","I've updated the cuts to be clearer now.","","👍 (1)"
"566723219088736287","BlairTempest#8218","06-Aug-22 07:15 PM","thanks","",""
"843568402434097183","eddie_keeno#6861","06-Aug-22 07:31 PM","Been away from internet for a day or so any updates? Anything found?","",""
"566723219088736287","BlairTempest#8218","06-Aug-22 07:31 PM","nothin","",""
"843568402434097183","eddie_keeno#6861","06-Aug-22 07:32 PM","Jeez much trickier than last time then","",""
"448645045701181440","JR#6942","06-Aug-22 09:00 PM","","https://cdn.discordapp.com/attachments/1004807688636612698/1005550938469171230/Screenshot_20220806-193710.jpg",""
"448645045701181440","JR#6942","06-Aug-22 09:00 PM","this has gotta be related somehow ^","",""
"263467697596006411","nope#2550","06-Aug-22 09:10 PM","oh shit you found it","",""
"527216700454731796","jacktitlow#7725","06-Aug-22 09:14 PM","Where's the pic from","",""
"263703743411912707","volt64bolt#2496","06-Aug-22 09:32 PM","probs the photographers insta","",""
"263703743411912707","volt64bolt#2496","06-Aug-22 09:32 PM","or jewllers","",""
"924476438235729981","lizllewop#7237","06-Aug-22 09:39 PM","I thought it was the transparent pic off reddit","",""
"158854267355004928","MrDKOz#5383","06-Aug-22 09:51 PM","All the pictures of the fish are on https://mrdkoz.notion.site","",""
"116292981656518656","Eternal#4263","06-Aug-22 09:55 PM","@MrDKOz the one for the silly song shows site can go red now, it was confirmed fake by mod","",""
"250712387370483714","D4N#0472","06-Aug-22 10:01 PM","anyone else notice this on his instagram pp","https://cdn.discordapp.com/attachments/1004807688636612698/1005566383851044934/unknown.png",""
"158854267355004928","MrDKOz#5383","06-Aug-22 10:01 PM","Awesome thank you for letting me know! Do you know where the confirmation by the mod was made? Would like to provide a screenshot of the proof 🙂","",""
"116292981656518656","Eternal#4263","06-Aug-22 10:05 PM","🙂","https://cdn.discordapp.com/attachments/1004807688636612698/1005567429377798244/Screenshot_2022-08-06_at_21.05.46.png",""
"790602272760528947","MouseBearMan#1788","06-Aug-22 10:15 PM","In case anybody else wants to try some ""cyphers"". Couldn't find anything too obvious. Software should be self-explanatory, can be expanded to programmatically scan offset-combinations.","https://cdn.discordapp.com/attachments/1004807688636612698/1005569907397754950/goldfosh.py",""
"790602272760528947","MouseBearMan#1788","06-Aug-22 10:17 PM","If you have never used python this is most likely not worth any time.","",""
"263703743411912707","volt64bolt#2496","06-Aug-22 10:20 PM","why did you use tk inter for this? wouldnt it have been faster to just use the terminal","",""
"790602272760528947","MouseBearMan#1788","06-Aug-22 10:21 PM","i wanted to quickly click and see what happens. couldnt think of a quick way to do this in the terminal","",""
