AuthorID,Author,Date,Content,Attachments,Reactions
"679722117935399024","river#5860","04-Aug-22 07:47 PM","first","",""
"876992288138600518","Nugget man#7424","04-Aug-22 07:47 PM","Wow","",""
"722475364215160842","Lily Sparkles#9745","04-Aug-22 07:47 PM","Hi","",""
"264051145310208000","N278#6821","04-Aug-22 07:47 PM","lol","",""
"876992288138600518","Nugget man#7424","04-Aug-22 07:47 PM","Hello","",""
"843422076228206592","GeorgeSLYY#9950","04-Aug-22 07:48 PM","Ok lets dedicate this channel to anaylising the rest of the video!","","upvote (2)"
"256156090251739138","Chris P. Bacon#7541","04-Aug-22 07:49 PM","Should we start from start to end?","",""
"256156090251739138","Chris P. Bacon#7541","04-Aug-22 07:49 PM","or opposite?","",""
"189864893397073921","Kademo#7046","04-Aug-22 07:49 PM","did u guys find any clue?","",""
"843422076228206592","GeorgeSLYY#9950","04-Aug-22 07:49 PM","Ok so at the start he said its a gold fish then said trout in the song","",""
"671939353714622475","nike#7636","04-Aug-22 07:49 PM","Agreed","",""
"843422076228206592","GeorgeSLYY#9950","04-Aug-22 07:49 PM","but i think the gold fish was just to make the fosh joke","",""
"843422076228206592","GeorgeSLYY#9950","04-Aug-22 07:49 PM","Start to end","",""
"256156090251739138","Chris P. Bacon#7541","04-Aug-22 07:50 PM","is there a connection between other videos and this one, compare references?","",""
"256156090251739138","Chris P. Bacon#7541","04-Aug-22 07:50 PM","alright","",""
"189864893397073921","Kademo#7046","04-Aug-22 07:50 PM","""in the name of max, dish out the fish""
does this mean we have to use (maxo)?","",""
"843422076228206592","GeorgeSLYY#9950","04-Aug-22 07:50 PM","wdym?","",""
"149928915631079424","ryxn#6473","04-Aug-22 07:50 PM","It’s in Darlington!!","",""
"671939353714622475","nike#7636","04-Aug-22 07:50 PM","No. That is just what you must say to the person he has chosen","",""
"843422076228206592","GeorgeSLYY#9950","04-Aug-22 07:51 PM","I think after we finish a simple anaylisis of the video we should be searching tiktok like mad","",""
"256156090251739138","Chris P. Bacon#7541","04-Aug-22 07:51 PM","yep","",""
"671939353714622475","nike#7636","04-Aug-22 07:51 PM","I think he was saying that it’s unnecessary to do silly dances on tiktok etc…. Because none of that is the answer","",""
"843422076228206592","GeorgeSLYY#9950","04-Aug-22 07:53 PM","But he literally says exactly who to ask and how just use my vid to find out","",""
"843422076228206592","GeorgeSLYY#9950","04-Aug-22 07:53 PM","So we have to ask in a certain way (""how"")","",""
"922531793226313769","NoelHuibers#5507","04-Aug-22 07:53 PM","i was going the road of song silly shows. the artists name is ""new artist of today"" and the album looks kind of weird. Could be completly the wrong direction but this was my first idea","",""
"256156090251739138","Chris P. Bacon#7541","04-Aug-22 07:53 PM","copy audio and insert it to tik tok?","",""
"843422076228206592","GeorgeSLYY#9950","04-Aug-22 07:54 PM","Send the album photo","",""
"843422076228206592","GeorgeSLYY#9950","04-Aug-22 07:54 PM","how do u think it relates?","",""
"843422076228206592","GeorgeSLYY#9950","04-Aug-22 07:54 PM","Maybe","",""
"256156090251739138","Chris P. Bacon#7541","04-Aug-22 07:54 PM","but 202?","",""
"843422076228206592","GeorgeSLYY#9950","04-Aug-22 07:55 PM","He says ""with the possibilty the world is packed""","",""
"843422076228206592","GeorgeSLYY#9950","04-Aug-22 07:55 PM","What does the ""world is packed"" mean","",""
"671939353714622475","nike#7636","04-Aug-22 07:55 PM","Means many people will search","",""
"256156090251739138","Chris P. Bacon#7541","04-Aug-22 07:55 PM","","https://cdn.discordapp.com/attachments/1004807711709470821/1004809928243957781/silly_shows.PNG",""
"256156090251739138","Chris P. Bacon#7541","04-Aug-22 07:56 PM","Release 2021","",""
"922531793226313769","NoelHuibers#5507","04-Aug-22 07:56 PM","yeeh thats what i found aswell.","",""
"843422076228206592","GeorgeSLYY#9950","04-Aug-22 07:56 PM","I think u have cracked something there coz it looks like the spectrogram","",""
"256156090251739138","Chris P. Bacon#7541","04-Aug-22 07:56 PM","Looked it up after you said it","",""
"348466949648285708","GeorgeW#1670","04-Aug-22 07:56 PM","Right, I’m assuming that it’s Not a physical thing. Anyone in the world can do it, so it must be someone who can be contacted online, which removes SimSim from the search as they’re uncontactable, it also removes bigger influencers, as the chances of them being able to see someone attempting to contact are slim to none","",""
"348466949648285708","GeorgeW#1670","04-Aug-22 07:56 PM","That’s all I’ve got","",""
"922531793226313769","NoelHuibers#5507","04-Aug-22 07:56 PM","the album has only words with S starting and looks like a description with the songs of the album","",""
"922531793226313769","NoelHuibers#5507","04-Aug-22 07:57 PM","but might be a completly wrong way","",""
"926212044947075122","Mr_Frog#2866","04-Aug-22 07:57 PM","what about contacting the person who valued it?","",""
"843422076228206592","GeorgeSLYY#9950","04-Aug-22 07:57 PM","nah i think they said not to contact like companies and stuff","",""
"926212044947075122","Mr_Frog#2866","04-Aug-22 07:57 PM","ok","",""
"256156090251739138","Chris P. Bacon#7541","04-Aug-22 07:58 PM","Big nono","",""
"348466949648285708","GeorgeW#1670","04-Aug-22 07:58 PM","So, it’s an individual, who max has worked with previously, that doesn’t really have following, so we can kinda rule out influencers, cause as I said, then seeing your message is slim to none","",""
"926212044947075122","Mr_Frog#2866","04-Aug-22 07:58 PM","ok","",""
"926212044947075122","Mr_Frog#2866","04-Aug-22 07:59 PM","i thin ask someone from the video ""In the name of Max Fosh, Dish out the fish""","",""
"217572426911973376","Touhou simp#9126","04-Aug-22 08:00 PM","it just sounds like a fisherman","",""
"926212044947075122","Mr_Frog#2866","04-Aug-22 08:00 PM","who to ask is probably in the video","",""
"348466949648285708","GeorgeW#1670","04-Aug-22 08:00 PM","I’d say, odds on they’re not in the fish video","",""
"926212044947075122","Mr_Frog#2866","04-Aug-22 08:00 PM","ok","",""
"217572426911973376","Touhou simp#9126","04-Aug-22 08:01 PM","""In the name of Max Fosh, Dish out the fish"" it sounds like the person your saying it to actually has the fish","",""
"767334862071529483","C47UMX#7091","04-Aug-22 08:01 PM","Could it be something to do with the queen? The transcript for the video says “tick tock” (that spelling) instead of TikTok which could be something? And then he references the queen","",""
"926212044947075122","Mr_Frog#2866","04-Aug-22 08:02 PM","yes","",""
"843422076228206592","GeorgeSLYY#9950","04-Aug-22 08:02 PM","where does it say ticktock?","",""
"348466949648285708","GeorgeW#1670","04-Aug-22 08:02 PM","Transcript is auto generated","",""
"348466949648285708","GeorgeW#1670","04-Aug-22 08:02 PM","So, I’d say it’s just the grammatically correct spelling and not a choice","",""
"843422076228206592","GeorgeSLYY#9950","04-Aug-22 08:02 PM","Yh agreed","",""
"348466949648285708","GeorgeW#1670","04-Aug-22 08:05 PM","What’s getting my attention is that he’s saying “what the song shows”, everyone’s focusing on the lyrics, which do matter, I think that what’s shown matters equally","",""
"725878469380014090","Rubix#4197","04-Aug-22 08:05 PM","""song silly"" could also be important, thats what the transcript says in the discord and the video","",""
"843422076228206592","GeorgeSLYY#9950","04-Aug-22 08:05 PM","Yh but it could mean ""shows"" as in the meaning of the lyrics","",""
"857256807839957003","Poppins#7134","04-Aug-22 08:05 PM","It is a bus stand near buckingham palace","",""
"348466949648285708","GeorgeW#1670","04-Aug-22 08:06 PM","Not a place, a person","",""
"857256807839957003","Poppins#7134","04-Aug-22 08:06 PM","maybe the queen herself XD","",""
"725878469380014090","Rubix#4197","04-Aug-22 08:06 PM","""neighbor"" on the bus is weird","",""
"843422076228206592","GeorgeSLYY#9950","04-Aug-22 08:06 PM","how come?","",""
"857256807839957003","Poppins#7134","04-Aug-22 08:06 PM","do we need to dox max and find out who his neighbour is?","",""
"725878469380014090","Rubix#4197","04-Aug-22 08:07 PM","maybe its just a regional phrase im not accustomed to","",""
"857256807839957003","Poppins#7134","04-Aug-22 08:07 PM","and then meet that person on a bus?","",""
"843422076228206592","GeorgeSLYY#9950","04-Aug-22 08:07 PM","Do you mean the spelling of it?","",""
"725878469380014090","Rubix#4197","04-Aug-22 08:07 PM","just referring to someone as a neighbor if your on a bus with them is something ive never really heard","",""
"348466949648285708","GeorgeW#1670","04-Aug-22 08:07 PM","I’m going if the assumption that all he’s saying is it could be anyone","",""
"843422076228206592","GeorgeSLYY#9950","04-Aug-22 08:08 PM","Most likely mean next to","",""
"843422076228206592","GeorgeSLYY#9950","04-Aug-22 08:08 PM","As in the person next to me on the bus","",""
"843422076228206592","GeorgeSLYY#9950","04-Aug-22 08:08 PM","Yh thats what i think with the whole phrase aswell","",""
"843422076228206592","GeorgeSLYY#9950","04-Aug-22 08:08 PM","I dont think its literal","",""
"348466949648285708","GeorgeW#1670","04-Aug-22 08:08 PM","Like; I’m talking, contextually, to how the bible says “love thy neighbour” or whatever, and it’s he saying it in that way, like everyone’s your neighbour","",""
"843422076228206592","GeorgeSLYY#9950","04-Aug-22 08:09 PM","I think the contrast between neighbour on the bus and dear old queen just means it can be anyone","",""
"264051145310208000","N278#6821","04-Aug-22 08:12 PM","nah the queen is sitting in a bus at this moment waiting for someone to find her XD","",""
"256156090251739138","Chris P. Bacon#7541","04-Aug-22 08:16 PM","so album cover lead is cold","",""
"256156090251739138","Chris P. Bacon#7541","04-Aug-22 08:17 PM","the sponsor of the video was registered after the upload of the album upload","",""
"843422076228206592","GeorgeSLYY#9950","04-Aug-22 08:17 PM","Idk coz he says in the desc ""All you need to solve the treasure hunt is in this video.""","",""
"256156090251739138","Chris P. Bacon#7541","04-Aug-22 08:17 PM","video was probably planned with sponsor at least for finance","",""
"256156090251739138","Chris P. Bacon#7541","04-Aug-22 08:17 PM","Reg. Code    16235024
Company status    Entered into the register
Year established    2021 / 1 year and 2 months","",""
"679362472020279317","Hii#4258","04-Aug-22 08:18 PM","Maybe someone whos a neighbor to a queen","",""
"679362472020279317","Hii#4258","04-Aug-22 08:18 PM","Not many people i suppose","",""
"843422076228206592","GeorgeSLYY#9950","04-Aug-22 08:18 PM","Is that lightyear?","",""
"256156090251739138","Chris P. Bacon#7541","04-Aug-22 08:19 PM","yes","",""
"843422076228206592","GeorgeSLYY#9950","04-Aug-22 08:20 PM","Idk its just that he says everything you need is in the video but idk if he means that there will be no external leads","",""
"972492357331193876","atomfear#5406","04-Aug-22 08:20 PM","hello","",""
"754109906658918531","AlejandroLocoBoy#0885","04-Aug-22 08:22 PM","Alr, We got ""Masquerade"" analysis pending, chord progression, (failed) spectrogram, and pain.","",""
"777892667568554025","Da Goose#2182","04-Aug-22 08:23 PM","i noticed that ther're in a chapple, according to the piano","",""
"843422076228206592","GeorgeSLYY#9950","04-Aug-22 08:23 PM","chapple is the brand","",""
"777892667568554025","Da Goose#2182","04-Aug-22 08:23 PM","oh, okey","",""
"348466949648285708","GeorgeW#1670","04-Aug-22 08:23 PM","Right; I think we’re looking to far into it, he says “single clue at the end of the video” at the start, so…","","☝️ (1)"
"843422076228206592","GeorgeSLYY#9950","04-Aug-22 08:24 PM","True","",""
"348466949648285708","GeorgeW#1670","04-Aug-22 08:26 PM","He also uses only singular words to discuss the clue, using only the word “clue”, which implies it’s singularity","",""
"1004818934450630656","Maxatrillion#0605","04-Aug-22 08:47 PM","Chappell","",""
"763389170583732275","SaAnd#6075","04-Aug-22 08:49 PM","Let’s see then","",""
"763389170583732275","SaAnd#6075","04-Aug-22 08:50 PM","There is a brand","",""
"763389170583732275","SaAnd#6075","04-Aug-22 08:50 PM","But","",""
"763389170583732275","SaAnd#6075","04-Aug-22 08:50 PM","The name isn’t on the side","",""
"627147191659528212","FletcherRodger#8229","04-Aug-22 08:58 PM","","https://cdn.discordapp.com/attachments/1004807711709470821/1004825643403444327/unknown.png",""
"876992288138600518","Nugget man#7424","04-Aug-22 08:59 PM","Ooh","",""
"417367513303875594","Nextensi#2388","04-Aug-22 09:06 PM","Where'd you find this?","",""
"197548565881421834","DaBull#9261","04-Aug-22 09:06 PM","","https://cdn.discordapp.com/attachments/1004807711709470821/1004827657894117478/thibng.png",""
"398107630524039170","hekerman#7015","04-Aug-22 09:08 PM","what software are you using?","",""
"197548565881421834","DaBull#9261","04-Aug-22 09:10 PM","i just found in in general, im trying to do it myself to verify but i got no clue how","",""
"197548565881421834","DaBull#9261","04-Aug-22 09:10 PM","if you know how, you can try changing the song into a audio spectrogram","",""
"203758781388029962","dmf444#6939","04-Aug-22 09:11 PM","Heyo","",""
"203758781388029962","dmf444#6939","04-Aug-22 09:12 PM","Someone else who's actually trying what i'm after","",""
"203758781388029962","dmf444#6939","04-Aug-22 09:12 PM","The first section sounds like someone talking","",""
"203758781388029962","dmf444#6939","04-Aug-22 09:12 PM","But I can't figure out how to normalize the audio to listen","",""
"592094921519792316","EmmaS#0894","04-Aug-22 09:14 PM","looking through Max's tiktok, it is mostly just clips from his videos. However, there is one video in 2020 where he is doing a silly dance and lipsyncing to a ben Platt song called Rain but the joke is that it sounds like Lorraine","",""
"347160194259877930","Canadian Cheese#5573","04-Aug-22 09:18 PM","Oh we messing with audio in here? That's my jam","",""
"347160194259877930","Canadian Cheese#5573","04-Aug-22 09:19 PM","I might be of service","",""
"203758781388029962","dmf444#6939","04-Aug-22 09:19 PM","You able to pull a waveform from spectrogram?","",""
"347160194259877930","Canadian Cheese#5573","04-Aug-22 09:19 PM","You mean other way around?","",""
"203758781388029962","dmf444#6939","04-Aug-22 09:19 PM","nope","",""
"417367513303875594","Nextensi#2388","04-Aug-22 09:19 PM","https://youtube.com/clip/UgkxngLdBaQiUUqfeXFbMgkaIZ7_iOH2fvAK","",""
"347160194259877930","Canadian Cheese#5573","04-Aug-22 09:20 PM","How did you get the spectrogram?","",""
"203758781388029962","dmf444#6939","04-Aug-22 09:20 PM","I grabbed the spectrogram from Auditions","",""
"203758781388029962","dmf444#6939","04-Aug-22 09:20 PM","It looks like a waveform is embedded into the high frequency","",""
"347160194259877930","Canadian Cheese#5573","04-Aug-22 09:20 PM","Are you talking about the lines that look like midi?","",""
"203758781388029962","dmf444#6939","04-Aug-22 09:20 PM","i don't think it's midi","",""
"280718235865841664","Willox#2520","04-Aug-22 09:20 PM","I guess he is talking about this part","https://cdn.discordapp.com/attachments/1004807711709470821/1004831336034484377/unknown.png",""
"203758781388029962","dmf444#6939","04-Aug-22 09:21 PM","yep. those lines","",""
"347160194259877930","Canadian Cheese#5573","04-Aug-22 09:21 PM","Does it not look like a piano roll to you?","",""
"333631531387977735","John Nash#5255","04-Aug-22 09:21 PM","","https://cdn.discordapp.com/attachments/1004807711709470821/1004831550476664894/unknown.png",""
"347160194259877930","Canadian Cheese#5573","04-Aug-22 09:22 PM","I have an idea maybe if we sweep a bandpass there might be something hidden in there","",""
"347160194259877930","Canadian Cheese#5573","04-Aug-22 09:22 PM","Let me go get on my computer","",""
"203758781388029962","dmf444#6939","04-Aug-22 09:23 PM","could be. But the edges are rather... fuzzy. I figured it'd be some set of audio. You're probably right tho","",""
"852552890103234560","andy_22#0470","04-Aug-22 09:25 PM","look into","",""
"160137533555081216","Hearts#7554","04-Aug-22 09:25 PM","Any non-piano sound?","",""
"852552890103234560","andy_22#0470","04-Aug-22 09:25 PM","look into #hunt-general ! an important clue has been found","",""
"852552890103234560","andy_22#0470","04-Aug-22 09:25 PM","a secund one from the piano guy","",""
"852552890103234560","andy_22#0470","04-Aug-22 09:25 PM","second*","",""
"160137533555081216","Hearts#7554","04-Aug-22 09:26 PM","Piano could be made of ivory, Piano has a bridge, he said search wider so im thinking non-piano notes","",""
"417367513303875594","Nextensi#2388","04-Aug-22 09:27 PM","Joe Jenkins Clue:

The fish swims under the bridge while I tickle the ivory, but why hasn’t it been found? Perhaps the search should be deployed, wider.","",""
"434713391420932096","TobyToes03#4964","04-Aug-22 09:29 PM","Anybody made any advances on ""neighbour on a bus""?","",""
"347160194259877930","Canadian Cheese#5573","04-Aug-22 09:30 PM","No I'm dumb lol I don't get any of this","",""
"272235825498947594","Gifting aka DaffinTheDuck#9058","04-Aug-22 09:33 PM","Im making a discord for clues etc. Dm if u want an invite. Ik there is a doc but its easier so people dont delete stuff.","",""
"203758781388029962","dmf444#6939","04-Aug-22 09:34 PM","anything help with the lowpass?","",""
"347160194259877930","Canadian Cheese#5573","04-Aug-22 09:34 PM","I just pulled up the video on Ableton now","",""
"297803640100618241","Niborgator#9661","04-Aug-22 09:36 PM","right before the clue when it fades to black, max points at the back of the fish and says something
timecode 4:28 
maybe someone can read his lips?","",""
"347160194259877930","Canadian Cheese#5573","04-Aug-22 09:36 PM","Can't find anything","",""
"203758781388029962","dmf444#6939","04-Aug-22 09:36 PM","I'm 90% sure","",""
"203758781388029962","dmf444#6939","04-Aug-22 09:36 PM","this is audio","",""
"347160194259877930","Canadian Cheese#5573","04-Aug-22 09:36 PM","Well I guess I'll listen in reverse lol","",""
"203758781388029962","dmf444#6939","04-Aug-22 09:37 PM","take a look at this","",""
"203758781388029962","dmf444#6939","04-Aug-22 09:37 PM","","https://cdn.discordapp.com/attachments/1004807711709470821/1004835519680745513/unknown.png",""
"203758781388029962","dmf444#6939","04-Aug-22 09:37 PM","tell me that isn't audio","",""
"347160194259877930","Canadian Cheese#5573","04-Aug-22 09:38 PM","Oh yeah that's definitely a waveform","",""
"203758781388029962","dmf444#6939","04-Aug-22 09:38 PM","but it's embedded in the Spec...","",""
"203758781388029962","dmf444#6939","04-Aug-22 09:38 PM","how do i pull this out lol","",""
"347160194259877930","Canadian Cheese#5573","04-Aug-22 09:39 PM","Uhhhh I'm gonna try a few things, I'm not super familiar with spectrograms tbh","",""
"203758781388029962","dmf444#6939","04-Aug-22 09:39 PM","that's ait","",""
"203758781388029962","dmf444#6939","04-Aug-22 09:39 PM","neither am i","",""
"305883139144941568","NerdyPopRocks#8567","04-Aug-22 09:45 PM","Welp… there goes my day’s productivity","",""
"347160194259877930","Canadian Cheese#5573","04-Aug-22 09:48 PM","There should be a marquee tool where you can highlight a section of the spectrogram","",""
"347160194259877930","Canadian Cheese#5573","04-Aug-22 09:48 PM","Still trying to figure out how to isolate it","",""
"203758781388029962","dmf444#6939","04-Aug-22 09:48 PM","i can isolate it","",""
"347160194259877930","Canadian Cheese#5573","04-Aug-22 09:48 PM","Oh cool","",""
"203758781388029962","dmf444#6939","04-Aug-22 09:48 PM","but can't get it to play the inverse of the selection","",""
"347160194259877930","Canadian Cheese#5573","04-Aug-22 09:49 PM","Right that's what I'm trying to figure  out","",""
"709827976929345567","Golden Wither#7748","04-Aug-22 09:49 PM","even if you isolate it how are you going to know which frequencies go where?","",""
"347160194259877930","Canadian Cheese#5573","04-Aug-22 09:49 PM","Wdym?","",""
"347160194259877930","Canadian Cheese#5573","04-Aug-22 09:49 PM","There's a waveform inside the spectrogram that likely contains a hidden message","",""
"347160194259877930","Canadian Cheese#5573","04-Aug-22 09:50 PM","Or some sort of clue","",""
"709827976929345567","Golden Wither#7748","04-Aug-22 09:50 PM","right but a waveform by itself cant play audio","",""
"272235825498947594","Gifting aka DaffinTheDuck#9058","04-Aug-22 09:50 PM","Im making a discord for clues etc. Dm if u want an invite. Ik there is a doc but its easier so people dont delete stuff.","",""
"347160194259877930","Canadian Cheese#5573","04-Aug-22 09:51 PM","Isn't that, like the only thing it can do lol","",""
"347160194259877930","Canadian Cheese#5573","04-Aug-22 09:51 PM","Were not using Photoshop we're using an analyzer to isolate it","",""
"778220865203994645","avishai#4366","04-Aug-22 09:51 PM","me please","",""
"709827976929345567","Golden Wither#7748","04-Aug-22 09:52 PM","a waveform is just the volume of a sound not the frequencies contained within it","",""
"709827976929345567","Golden Wither#7748","04-Aug-22 09:52 PM","thats why the spectrogram needs colors","",""
"347160194259877930","Canadian Cheese#5573","04-Aug-22 09:52 PM","Oh?","",""
"347160194259877930","Canadian Cheese#5573","04-Aug-22 09:52 PM","Like I said I don't know shiz about spectrograms lol","",""
"709827976929345567","Golden Wither#7748","04-Aug-22 09:53 PM","yeah on a spectrogram the color is the volume and the height is the frequency","",""
"709827976929345567","Golden Wither#7748","04-Aug-22 09:53 PM","so without color i dont thing you could get much","",""
"203758781388029962","dmf444#6939","04-Aug-22 09:54 PM","But it's purposly added to the spec. So if it's not waveform, what could it be?","",""
"709827976929345567","Golden Wither#7748","04-Aug-22 09:54 PM","thats whats confusing me too cause its no mistake that its there","",""
"95147651565101056","zabraih#3296","04-Aug-22 09:55 PM","doesn't it kinda look like text","",""
"203758781388029962","dmf444#6939","04-Aug-22 09:55 PM","You know of any program that takes about 6 audio channels?","",""
"280718235865841664","Willox#2520","04-Aug-22 09:55 PM","I have zero knowledge in spectrograms as well, but if you try to guess frequencies, won't the quality be hella bad but still understandable?","",""
"170338431526895616","Blazing13#8653","04-Aug-22 09:55 PM","Does that waveform match anything in the video?","","👆 (1)"
"203758781388029962","dmf444#6939","04-Aug-22 09:56 PM","After 4 tone downs, this is what it looks like to me","https://cdn.discordapp.com/attachments/1004807711709470821/1004840389892636792/unknown.png",""
"709827976929345567","Golden Wither#7748","04-Aug-22 09:57 PM","its a possibility but i thinik itll be real hard to pull off","",""
"342375302619594762","Volarus#5594","04-Aug-22 09:57 PM","what about significant numbers","",""
"342375302619594762","Volarus#5594","04-Aug-22 09:57 PM","1700 stones","",""
"342375302619594762","Volarus#5594","04-Aug-22 09:57 PM","18 carats","",""
"170338431526895616","Blazing13#8653","04-Aug-22 09:57 PM","He's following 125 accounts on tik tok","",""
"170338431526895616","Blazing13#8653","04-Aug-22 09:58 PM","What are the time stamps for those gaps?","",""
"170338431526895616","Blazing13#8653","04-Aug-22 09:58 PM","Do they correspond with words?","",""
"709827976929345567","Golden Wither#7748","04-Aug-22 09:58 PM","and 2 black spinels","",""
"203758781388029962","dmf444#6939","04-Aug-22 09:59 PM","the time gaps are huge","","👍 (1)"
"203758781388029962","dmf444#6939","04-Aug-22 10:00 PM","","https://cdn.discordapp.com/attachments/1004807711709470821/1004841172814016652/unknown.png",""
"203758781388029962","dmf444#6939","04-Aug-22 10:00 PM","There's an image of my interface","",""
"203758781388029962","dmf444#6939","04-Aug-22 10:00 PM","you can see time laid out at the top","",""
"709827976929345567","Golden Wither#7748","04-Aug-22 10:00 PM","what program is this?","",""
"203758781388029962","dmf444#6939","04-Aug-22 10:00 PM","Adobe Auditions","","👍 (1)"
"342375302619594762","Volarus#5594","04-Aug-22 10:03 PM","anyone have sheet music for the song?","",""
"485504759772610571","PauI#1925","04-Aug-22 10:05 PM","https://www.tiktok.com/music/Silly-Shows-6968568616765622273","",""
"142739869142089728","k3rnel-pan1c#5034","04-Aug-22 10:18 PM","no voice","https://cdn.discordapp.com/attachments/1004807711709470821/1004845776578551818/Record_2022-08-04-22-15-25.mp4","💯 (2)"
"389111703725539328","stealth.py#5525","04-Aug-22 10:29 PM","https://opencorporates.com/companies/gb/12069656 probably means nothing","",""
"389111703725539328","stealth.py#5525","04-Aug-22 10:29 PM","but","",""
"389111703725539328","stealth.py#5525","04-Aug-22 10:29 PM","just gonna put it out there","",""
"915517445832314920","unjad#4847","04-Aug-22 10:37 PM","","https://cdn.discordapp.com/attachments/1004807711709470821/1004850605854052443/RPReplay_Final1659644600_2.mp3","👍 (2)"
"754109906658918531","AlejandroLocoBoy#0885","04-Aug-22 11:25 PM","Is this raw piano audio? Nice, thanks!","",""
"754109906658918531","AlejandroLocoBoy#0885","04-Aug-22 11:26 PM","Now just gotta try separating bass cleft & treble (The treble is the wider bridge, wild guess, but so is everythign)","",""
"754109906658918531","AlejandroLocoBoy#0885","04-Aug-22 11:26 PM","although that might not be, well, *possible*","",""
"766410028286083082","JayHawk#4900","04-Aug-22 11:27 PM","Do the notes in the piano part somehow spell a word somewhere in the song?","",""
