AuthorID,Author,Date,Content,Attachments,Reactions
"333425758665965568","Floofy#0171","11-Aug-22 09:05 PM","Alice in wonderland could be related
Fish character
Queen character
Tea
I mean it could be something","",""
"1004923144945025024","MarcoL#5740","11-Aug-22 09:06 PM","I think it is","",""
"333425758665965568","Floofy#0171","11-Aug-22 09:06 PM","And technically its a book for children","",""
"284110442257711117","Gianni#0162","11-Aug-22 09:08 PM","been down this road","","👍 (1)"
"284110442257711117","Gianni#0162","11-Aug-22 09:08 PM","Hi all","",""
"250706700837847050","Welshie2000#3396","11-Aug-22 09:10 PM","Yo","",""
"199865843855785984","ipixelbot#2660","11-Aug-22 09:13 PM","Sup Gianni","",""
"199865843855785984","ipixelbot#2660","11-Aug-22 09:14 PM","How are you","",""
"199865843855785984","ipixelbot#2660","11-Aug-22 09:14 PM","Have you made any progress","",""
"250706700837847050","Welshie2000#3396","11-Aug-22 09:16 PM","Anyone else got to a website that redirects to another site then asks for a username and password?","",""
"848850497331003423","catjake2k22#1815","11-Aug-22 09:17 PM","whatwebstie is that then?","",""
"536290766440628254","Skyhunter#3221","12-Aug-22 12:23 AM","How did you get on hacking the website?","",""
"250706700837847050","Welshie2000#3396","12-Aug-22 12:39 AM","No such skill haha","",""
"536290766440628254","Skyhunter#3221","12-Aug-22 12:40 AM","just a random thought to throw into the ether, What if the World is packed is referring to the Globe theatre, (the theatre is packed). with the  coincidence being shackspeare referred to it as his Wooden O (fish with an O)","",""
"212020468008484864","Bd09live#1901","12-Aug-22 12:54 AM","it was something i was considering but i dont know how it helps find a person","",""
"387147613335453706","swashbuckler#1309","12-Aug-22 01:27 AM","How confident are you that you are on the right track?","",""
"212020468008484864","Bd09live#1901","12-Aug-22 01:28 AM","If you are were I think you are then yeah I have but it was a stretch","",""
"848850497331003423","catjake2k22#1815","12-Aug-22 02:01 AM","It’s been said before","",""
"1005204170250403913","mattnewell#3604","12-Aug-22 03:20 AM","That's not a ""big coincidence"" that one poet has written poems related to a bus and also related to a queen. Barely a coincidence at all.","",""
"1005204170250403913","mattnewell#3604","12-Aug-22 03:22 AM","where has this come from","",""
"1005204170250403913","mattnewell#3604","12-Aug-22 03:22 AM","also oyster where's that come from","",""
"318649930371563520","Hyperterdle6#7817","12-Aug-22 04:31 AM","99% of everything said in this discord","","kekw (3)"
"161289504747945984","LiberaVeritas#1294","12-Aug-22 04:55 AM","I'd say it's mostly linking *too* much","",""
"1006273678046142584","kindnessiskey#6625","12-Aug-22 12:30 PM","","https://cdn.discordapp.com/attachments/1004807711709470821/1007596901518028900/Screenshot_20220812-112627.jpg",""
"146234060765659137","ramo_pyjamo#8086","12-Aug-22 06:48 PM","Bruh, and light year was the sponsor","",""
"146234060765659137","ramo_pyjamo#8086","12-Aug-22 06:48 PM","Coincidence, I think not","",""
"161289504747945984","LiberaVeritas#1294","12-Aug-22 06:49 PM","I MAX","","🔥 (1)"
"161289504747945984","LiberaVeritas#1294","12-Aug-22 06:49 PM","Coincidence? 🤡","",""
"295107387675901953","Der_DennisOP#3483","12-Aug-22 06:50 PM","conspiracy theory...","",""
"663187956047020032","PandemicKarma14#6566","12-Aug-22 09:20 PM","But how does that link to the song","",""
"284014364745531394","Reisu#5169","12-Aug-22 09:37 PM","In the version posted to BilliBilli the entire ad read was removed so it is likely that there aren't any links to lightyear otherwise it would have been left in","",""
"202877087781093376","CLJS#9785","12-Aug-22 11:12 PM","If you take out FISH from MAXFOSH, you get MAXI --> IMAX 😮 (if you also add I)","",""
"1005313418670112899","McThrifty#0421","12-Aug-22 11:21 PM","Where does the o go?","",""
"202877087781093376","CLJS#9785","12-Aug-22 11:22 PM","in the face","","😆 (2)"
"202877087781093376","CLJS#9785","12-Aug-22 11:22 PM",": o --> 😮","",""
"1005313418670112899","McThrifty#0421","12-Aug-22 11:24 PM","Oh (d’oh!)","",""
"123300511850954756","scales#0441","13-Aug-22 02:16 AM","well this just made me go on a journey on board a really dumb train of thought 🚂","",""
"202877087781093376","CLJS#9785","13-Aug-22 02:35 AM","I've reached the point of trolling because all my threads after 8 days were shit 😂 

I resorted to writing a script to find different types of fish you can find in Max's name. If you use ""Maximilian Fosh"", you can find Lion(fish) and Salmon and then using the letters from those maybe leads somewhere...but hey ho, im confused. I'm also considering a thread where you shift the how and who to find one another since ""who"" and ""how"" are just one another cycled. 

Tl;dr im going insane after spending ~1-2hrs a day on different paths for 8 days 😂","",""
"123300511850954756","scales#0441","13-Aug-22 02:42 AM","Yeah, I feel that. I've gone down a few stupid paths, only one has been something that felt useful. This current one passes the 6 year old test, but only works for a couple lines.","",""
"202877087781093376","CLJS#9785","13-Aug-22 02:46 AM","Well hopefully it pans out 😄 id ask for details but not bout to steal a potential answer","",""
"202877087781093376","CLJS#9785","13-Aug-22 02:47 AM","Imo a 6yo would just say ""just buy it"", so a solution could be to bid in max's dms","",""
"123300511850954756","scales#0441","13-Aug-22 02:47 AM","I wouldn't be surprised if it's set up in a pretty automated way to claim, or in a way that max has no control over","",""
"202877087781093376","CLJS#9785","13-Aug-22 02:48 AM","Yeah, website with a form, or an email address, would be the most logical","",""
"202877087781093376","CLJS#9785","13-Aug-22 02:49 AM","Disassociated from any specific person - doesn't let you spam any person, or directly max. Also allows for proper timestamping and contact","",""
"202877087781093376","CLJS#9785","13-Aug-22 02:49 AM","But this is all day 1 stuff 😂","",""
"123300511850954756","scales#0441","13-Aug-22 02:59 AM","Yeah, it's obviously inspired by Forrest Fenn's poem. Solve the riddle, it will reveal the names of the waypoints to find the treasure. Fenn always asserted that it could be solved by anyone, and no specialized knowledge was required. Which, while true for some aspects of it, still required a decade of searching for someone to find it.","",""
"123300511850954756","scales#0441","13-Aug-22 03:00 AM","The thing I'll be curious about once it's found, is whether or not there's a similar overarching theme to the song that I'm missing. Fenn's was basically ""the treasure is in the place I want to die""","","💜 (1),👆 (2)"
"146234060765659137","ramo_pyjamo#8086","13-Aug-22 03:31 AM","By using sarcasm","",""
"713989010170839071","coolakin#7111","13-Aug-22 07:08 PM","Guys I solved it","","upvote (8),♻️ (2),🔁 (2),🧢 (1)"
"447645520157081600","grantzke#8452","13-Aug-22 07:10 PM","oh do tell","",""
"210191030623010816","Duke#0364","13-Aug-22 07:56 PM","Guys....I didn't solve it","","upvote (14)"
"318649930371563520","Hyperterdle6#7817","13-Aug-22 08:25 PM","https://tenor.com/view/buzz-lightyear-gif-21327280","",""
"159004946866503680","Lumphie#8360","13-Aug-22 11:39 PM","Guys I tried to solve it","","😔 (5)"
"713989010170839071","coolakin#7111","14-Aug-22 02:56 AM","Oh whoops I meant I didnt solve it","","🔁 (8),🤡 (7)"
"713989010170839071","coolakin#7111","14-Aug-22 02:56 AM","My bad boys","",""
"991191599650439198","Wintree#5551","15-Aug-22 03:24 AM","They unbanned me because of a post I made on Reddit, thankfully. Please don't edit messages to get users banned going forward, you went too far there... Let's just go our separate ways please, thank you. I'm going to block you, and I advise you do the same to me so we don't interact. @caa","",""
"64379605808590848","Atral#7130","15-Aug-22 10:08 AM","Lol that was not edited and I can't believe the mods were dumb enough to unban you after that","",""
"550449409897267214","George E#7769","15-Aug-22 06:00 PM","The difficulty is verifying things sent in dms","",""
"64379605808590848","Atral#7130","15-Aug-22 06:18 PM","that's when you have to use common sense","",""
"64379605808590848","Atral#7130","15-Aug-22 06:34 PM","In the future https://fotoforensics.com/ is a useful tool, if its been photoshopped it will usually show something like this in the metadata","https://cdn.discordapp.com/attachments/1004807711709470821/1008775759302766693/unknown.png",""
"158378304552828930","Froggy#4134","15-Aug-22 06:49 PM","you can get round that ez tho","","upvote (1)"
"795347239391199232","Patrick Tate#2720","15-Aug-22 06:49 PM","Literally just screenshot the photoshopped image…","","upvote (1)"
"64379605808590848","Atral#7130","15-Aug-22 06:52 PM","You can get around it of course, but you need to do it on the balance of probability","",""
"64379605808590848","Atral#7130","15-Aug-22 06:52 PM","Otherwise you never ban anyone and people can go around threatening to swat people in DMs as much as they like","",""
"550449409897267214","George E#7769","15-Aug-22 06:56 PM","You can inspect element Discord even on the app. So that wouldn’t help at all","",""
"64379605808590848","Atral#7130","15-Aug-22 06:56 PM","in the iPad app?","",""
"550449409897267214","George E#7769","15-Aug-22 06:56 PM","You can on Mac if you enable a certain setting","",""
"64379605808590848","Atral#7130","15-Aug-22 06:58 PM","I mean cmon how likely is it that caa decided out of nowhere to photoshop a DM to get that guy banned, I'm not gonna keep arguing with you about it because its ultimately your decision, but you decided at the time what the most likely situation was and should have been what was stuck with imo","",""
"550449409897267214","George E#7769","15-Aug-22 07:00 PM","It was originally a ban because the screenshot seemed very legit. I then saw the post about it on Reddit. Do I know if the dm was legit for sure? No, but I did ban them originally for it and changed my mind later.

Especially with Discord, it’s not hard. The web version looks exactly the same and so the screenshot could’ve been from there. (Almost) everyone knows inspect element, so I’m not putting it past them","","👍🏻 (2)"
"1006273678046142584","kindnessiskey#6625","16-Aug-22 12:45 AM","","https://cdn.discordapp.com/attachments/1004807711709470821/1008869074991849513/Screenshot_20220815-234502_Discord.jpg",""
"1006273678046142584","kindnessiskey#6625","16-Aug-22 12:45 AM","Putting this here so if my theory's right I don't get ripped off","",""
"1006273678046142584","kindnessiskey#6625","16-Aug-22 12:46 AM",":monke:","",""
"784825209407799297","RoGarf#7848","16-Aug-22 12:46 AM","Ok.","",""
"64379605808590848","Atral#7130","16-Aug-22 12:54 AM","You can still get ripped off","",""
"64379605808590848","Atral#7130","16-Aug-22 12:55 AM","Although you could probably take him to court","",""
"1006273678046142584","kindnessiskey#6625","16-Aug-22 01:00 AM","I wish I was a 16year old with more time 😫 I'd just finish it myself wahhh","",""
"64379605808590848","Atral#7130","16-Aug-22 01:01 AM","Nah i've been off work for a week with covid and i still haven't been able to solve it","",""
"64379605808590848","Atral#7130","16-Aug-22 01:01 AM","doesn't matter how many hours i spend staring at it","",""
"1006273678046142584","kindnessiskey#6625","16-Aug-22 01:04 AM","Hope your feeling okay","",""
"1006273678046142584","kindnessiskey#6625","16-Aug-22 01:05 AM","I have a 2 year old and a newborn so am literally doing it when they're asleep","",""
"64379605808590848","Atral#7130","16-Aug-22 01:09 AM","Well apparently a 6 year old can solve it so maybe you should get the newborn involved","",""
"1006273678046142584","kindnessiskey#6625","16-Aug-22 01:10 AM","That's a shout let me go wake them quick and let you know what they say:pog:","","pog (1),😆 (1)"
"967177132637835334","N.A.T.#9608","16-Aug-22 01:59 AM","Here's my random contribution to this hunt. I'm not actively searching for the fish however it is in my mind. One thing I noticed is that max seemed very focused on keeping the fished lined up a certain way which may be pointing in a specific direction. How anyone could find the location of the piano from just the inside is beyond me. But there are people like that. However max also indicated that anyone could do it so idk.","",""
"255855114286399491","Jacob W#9660","16-Aug-22 02:22 AM","This I have been looking at just now","",""
"255855114286399491","Jacob W#9660","16-Aug-22 02:22 AM","Geographically the fish points to a nail salon or a tech school for children. Neither of which seem particularly useful.","",""
"493150348072976384","Vapor#6991","16-Aug-22 02:22 AM","wait","",""
"493150348072976384","Vapor#6991","16-Aug-22 02:23 AM","maybe","",""
"493150348072976384","Vapor#6991","16-Aug-22 02:23 AM","i have an idea","",""
"493150348072976384","Vapor#6991","16-Aug-22 02:25 AM","take each direction the fish is pointing (on the stand) from the start of the video","",""
"493150348072976384","Vapor#6991","16-Aug-22 02:25 AM","and start going in that series of directions","",""
"493150348072976384","Vapor#6991","16-Aug-22 02:26 AM","(like left for however long the fish is facing that direction on screen, then right, then straight, etc)","",""
"412059271858094100","CaptainHair#6071","16-Aug-22 02:38 AM","The only issue with that theory is that Bilibili has the Lightyear segment cut out of it","","👍 (1)"
"412059271858094100","CaptainHair#6071","16-Aug-22 02:38 AM","Which features the fish the whole time","",""
"493150348072976384","Vapor#6991","16-Aug-22 02:59 AM","ah shoot right","",""
"161289504747945984","LiberaVeritas#1294","16-Aug-22 07:27 AM","https://youtu.be/kNovwPIWr3Q","",""
"755865980173025411","dantheo95#5852","16-Aug-22 12:04 PM","Why are you spamming this?","",""
"506149887277137920","Ferro#5017","17-Aug-22 01:53 AM","Don't spam this everywhere","",""
"929094412481491004","the_banana_counsel#7738","17-Aug-22 12:19 PM","banana","","🍌 (2)"
"412059271858094100","CaptainHair#6071","17-Aug-22 05:35 PM","so I didn’t solve the clue but I did pick up a new skill so this hunt hasn’t been all so bad","https://cdn.discordapp.com/attachments/1004807711709470821/1009485692990148718/IMG_3446.mov","👏 (13),👍 (7)"
"984879861288022079","raindropdrip#2976","17-Aug-22 06:11 PM","So we are looking for someone who's first name is Max?","",""
"984879861288022079","raindropdrip#2976","17-Aug-22 06:13 PM","*whose","",""
"795347239391199232","Patrick Tate#2720","17-Aug-22 06:14 PM","No","",""
"795347239391199232","Patrick Tate#2720","17-Aug-22 06:14 PM","It’s very unlikely at least","",""
"550449409897267214","George E#7769","17-Aug-22 06:41 PM","The right pedal sounds like it’s just held down 😆","","upvote (3)"
"550449409897267214","George E#7769","17-Aug-22 06:42 PM","Quality performance tho","",""
"412059271858094100","CaptainHair#6071","17-Aug-22 06:42 PM","yeah no i have no idea what i'm doing, i don't play piano 😂","",""
"795347239391199232","Patrick Tate#2720","17-Aug-22 06:43 PM","Generally lifting it between phrases or big chord changes will help! Using it sparingly is difficult but it really does sound better","","upvote (1)"
"795347239391199232","Patrick Tate#2720","17-Aug-22 06:43 PM","Good job though! Sounds amazing","",""
"550449409897267214","George E#7769","17-Aug-22 06:43 PM","Tldr; left pedal makes notes shorter, right makes notes longer","","👍 (1)"
"412059271858094100","CaptainHair#6071","17-Aug-22 06:44 PM","Thanks for the tips - I'll try and actually play something worthwhile someday","",""
"550449409897267214","George E#7769","17-Aug-22 06:44 PM","I haven’t played piano in a long time now","",""
"795347239391199232","Patrick Tate#2720","17-Aug-22 06:44 PM","Good luck!!!!","",""
"550449409897267214","George E#7769","17-Aug-22 06:44 PM","Rhythm is very good 👌","",""
"161289504747945984","LiberaVeritas#1294","17-Aug-22 06:45 PM","Honestly, now that you have the chords, you can play a ton of different songs/melodies with the same chords","",""
"412059271858094100","CaptainHair#6071","17-Aug-22 06:57 PM","It’s been fun to learn - makes me want to buy a piano now though 😂","",""
"984879861288022079","raindropdrip#2976","17-Aug-22 09:10 PM","Is the underlying tune a clue?  as in if we find the original song with the correct melody?","",""
"550449409897267214","George E#7769","17-Aug-22 10:07 PM","Mods don’t know anything about the hunt","",""
"249396990906073088","ken#4729","18-Aug-22 01:56 AM","you learn that by ear?","",""
"412059271858094100","CaptainHair#6071","18-Aug-22 01:57 AM","I did it by ear on guitar and then figured it out on the piano from that haha","",""
"249396990906073088","ken#4729","18-Aug-22 01:58 AM","oooh nice it's good","",""
"333631531387977735","John Nash#5255","21-Aug-22 01:26 AM","perchance","","pog (1)"
"318539860170506242","Wulfric#1022","21-Aug-22 04:58 AM","to dream","",""
"288287833024757760","tyleroconnor123#9235","22-Aug-22 12:02 PM","Could the keeper of the secret be deanna snuts?","",""
"288287833024757760","tyleroconnor123#9235","22-Aug-22 12:02 PM","Everyone calls her Dee for short","",""
"1005204170250403913","mattnewell#3604","22-Aug-22 02:53 PM","funny guy over here","",""
"384102257001496578","Snyptart#2409","22-Aug-22 07:35 PM","@CaptainHair that was awesome 👏","",""
"384102257001496578","Snyptart#2409","22-Aug-22 07:35 PM","I like the long notes lol eerie","",""
"288287833024757760","tyleroconnor123#9235","22-Aug-22 09:28 PM","no one likes my theory 😦","",""
"953317139006259242","lifessofun#5296","22-Aug-22 09:28 PM","F*cks sake hahaha (sorry bot)","",""
"723248733441097898","Isaiah.B#2583","24-Aug-22 06:52 AM","what if the keeper of the secret is a 6 year old","",""
"782364308633550848","fish#2804","24-Aug-22 09:11 AM","Maybe you're the keeper of the secret...","",""
"549355352953585675","Sherlock221b#4951","24-Aug-22 10:12 AM","Disagree.","",""
"288287833024757760","tyleroconnor123#9235","24-Aug-22 10:13 AM","My guy","",""
"549355352953585675","Sherlock221b#4951","24-Aug-22 10:13 AM","Don't beat yourself up.","",""
"549355352953585675","Sherlock221b#4951","24-Aug-22 10:13 AM","💪","",""
"550449409897267214","George E#7769","24-Aug-22 10:21 AM","If I knew more I’d have a $100k rn 😢","",""
"549355352953585675","Sherlock221b#4951","24-Aug-22 10:53 AM","Nah, 100k is only an estimate 😅","",""
"550449409897267214","George E#7769","24-Aug-22 10:54 AM","Yeah ik but I’ll take anything 😂","",""
"549355352953585675","Sherlock221b#4951","24-Aug-22 10:58 AM","£10 for you if I win","",""
"549355352953585675","Sherlock221b#4951","24-Aug-22 10:58 AM","At this rate, I'll give it all away","",""
"549355352953585675","Sherlock221b#4951","24-Aug-22 10:58 AM","ALL OF IT... MWHAHAHA","",""
"795347239391199232","Patrick Tate#2720","24-Aug-22 11:04 AM","wha","",""
"549355352953585675","Sherlock221b#4951","24-Aug-22 11:45 AM","Or. 
None of it.","",""
"549355352953585675","Sherlock221b#4951","24-Aug-22 11:45 AM","As I wouldn't sell","",""
"984879861288022079","raindropdrip#2976","24-Aug-22 11:53 AM","Hi George if I make a mind map of everyones ideas would you put it on the resources tab?  It will be an enormous mind map","","👍 (1)"
"984879861288022079","raindropdrip#2976","24-Aug-22 11:54 AM","https://tenor.com/view/mappe-mentali-mind-maps-mind-mapping-giulia-zavattaro-visual-thinking-gif-15351769","",""
"550449409897267214","George E#7769","24-Aug-22 11:54 AM","Can do","",""
"984879861288022079","raindropdrip#2976","24-Aug-22 11:55 AM","Will do later today","",""
"795347239391199232","Patrick Tate#2720","24-Aug-22 11:57 AM","Mind maps are hard to read, and you’ll find it really hard to discover all the ideas out there… if you uploaded one, how would you go about updating it etc","",""
"795347239391199232","Patrick Tate#2720","24-Aug-22 11:57 AM","The mind map isn’t gonna do anything that the site doesn’t","",""
"549355352953585675","Sherlock221b#4951","24-Aug-22 12:20 PM","This only works once you know a key.","",""
"549355352953585675","Sherlock221b#4951","24-Aug-22 12:20 PM","Or a pattern.","",""
"984879861288022079","raindropdrip#2976","24-Aug-22 12:20 PM","I think it would be useful to have every idea posted on a single large document people can use.  Cause otherwise people keep repeating the same stuff over and over again.  plus the other websites like dkoz is good but its a bit tricky to navigate.","",""
"549355352953585675","Sherlock221b#4951","24-Aug-22 12:20 PM","For example, ""Neighbour on the bus"" and have a mind map of that.","",""
"984879861288022079","raindropdrip#2976","24-Aug-22 12:20 PM","yes exactly","",""
"549355352953585675","Sherlock221b#4951","24-Aug-22 12:21 PM","But who's to say that sentence is right?","",""
"984879861288022079","raindropdrip#2976","24-Aug-22 12:21 PM","could have maybe 10 different mind maps on different topics so its easy to navigate","",""
"549355352953585675","Sherlock221b#4951","24-Aug-22 12:21 PM","Could be
1) Neighbour On
2) The Bus","",""
"549355352953585675","Sherlock221b#4951","24-Aug-22 12:22 PM","Just a thought to consider","",""
"795347239391199232","Patrick Tate#2720","24-Aug-22 01:35 PM","Yeah a google doc would work well, mind maps and discord just aren’t super compatible","",""
"64379605808590848","Atral#7130","24-Aug-22 02:06 PM","You can have interactive mind maps where each branch is expanded and you can add to over time","",""
"64379605808590848","Atral#7130","24-Aug-22 02:07 PM","doesn't have to be a still image","",""
"795347239391199232","Patrick Tate#2720","24-Aug-22 02:17 PM","Works well on paper, but i just don’t think a mind map will ever be easier to use/more accessible than a google doc","",""
"795347239391199232","Patrick Tate#2720","24-Aug-22 02:17 PM","Just my opinion ig","",""
"549355352953585675","Sherlock221b#4951","24-Aug-22 02:44 PM","It's a really good idea, the worst part is having a load of information all over the place...
Becomes more work managing it, and extra work to decipher it.","",""
"549355352953585675","Sherlock221b#4951","24-Aug-22 02:44 PM","Not knocking the idea!
Just ... KISS it 😀","",""
"235490390483009539","Lupine#7675","29-Aug-22 10:18 PM","I'm still on vacation, did we solve this yet?","",""
"795347239391199232","Patrick Tate#2720","29-Aug-22 10:18 PM","Nope ;(","",""
"235490390483009539","Lupine#7675","29-Aug-22 10:18 PM","Cool lol, cheers!","",""
"610796535877206016","Julio Coolio#6673","30-Aug-22 04:11 AM","Does anybody have any Theory’s connecting to Disney?","",""
"610796535877206016","Julio Coolio#6673","30-Aug-22 04:13 AM","Cause like","",""
"610796535877206016","Julio Coolio#6673","30-Aug-22 04:14 AM","Idk what I’m seeing but I found a hollagram lookin thing on the piano","",""
"610796535877206016","Julio Coolio#6673","30-Aug-22 04:14 AM","","https://cdn.discordapp.com/attachments/1004807711709470821/1013995108204556308/IMG_2548.jpg",""
"610796535877206016","Julio Coolio#6673","30-Aug-22 04:15 AM","","https://cdn.discordapp.com/attachments/1004807711709470821/1013995277520211968/IMG_2615.png",""
"610796535877206016","Julio Coolio#6673","30-Aug-22 04:15 AM","U can hardly see it","",""
"610796535877206016","Julio Coolio#6673","30-Aug-22 04:15 AM","But it’s there","",""
"610796535877206016","Julio Coolio#6673","30-Aug-22 04:16 AM","And to me it looks like Indiana jones or A guy with a hat on","",""
"610796535877206016","Julio Coolio#6673","30-Aug-22 04:16 AM","","https://cdn.discordapp.com/attachments/1004807711709470821/1013995519674155029/IMG_2571.jpg",""
"610796535877206016","Julio Coolio#6673","30-Aug-22 04:16 AM","And like","",""
"610796535877206016","Julio Coolio#6673","30-Aug-22 04:16 AM","Keeper of the secrets sounds like something out of a movie","",""
"610796535877206016","Julio Coolio#6673","30-Aug-22 04:16 AM","Idk just a theory","",""
"610796535877206016","Julio Coolio#6673","30-Aug-22 04:17 AM","🤷‍♂️","",""
"506149887277137920","Ferro#5017","30-Aug-22 04:21 AM","Hinge theory 2","","😆 (3)"
"610796535877206016","Julio Coolio#6673","30-Aug-22 04:22 AM","Where can I find that","",""
"784825209407799297","RoGarf#7848","30-Aug-22 05:00 AM","ALL HAIL THE HINGE. THE HINGE WILL SAVE US ALL.","",""
"720329906784960512","sneugelstroof#5561","30-Aug-22 11:25 AM","This looks like a water droplet on the camera lense, don't look into it any more imo","",""
"610796535877206016","Julio Coolio#6673","30-Aug-22 01:45 PM","I don’t think so a water droplet is more like 💧 and clear","",""
"610796535877206016","Julio Coolio#6673","30-Aug-22 01:45 PM","This looks to specific","",""
"610796535877206016","Julio Coolio#6673","30-Aug-22 01:45 PM","OH","",""
"610796535877206016","Julio Coolio#6673","30-Aug-22 01:45 PM","hinge","",""
"610796535877206016","Julio Coolio#6673","30-Aug-22 01:45 PM","Hinge","",""
"610796535877206016","Julio Coolio#6673","30-Aug-22 01:45 PM","Piano hinge","",""
"610796535877206016","Julio Coolio#6673","30-Aug-22 01:46 PM","Got it","",""
"610796535877206016","Julio Coolio#6673","30-Aug-22 01:46 PM","Idk I’ve never seen a circular hinge before and I’m a piano player myself","",""
"288287833024757760","tyleroconnor123#9235","30-Aug-22 02:07 PM","mf bringing back hinge theory from the dead","","🤣 (3),😆 (1)"
"720329906784960512","sneugelstroof#5561","30-Aug-22 09:46 PM","whatever it is be it dust or a droplet, it is an accidental artefact","",""
"610796535877206016","Julio Coolio#6673","30-Aug-22 11:04 PM","Oki doki thanks","","👍 (2)"
